id,answer,question,hint,desc
6a28daa1-f9e6-42a5-a8b8-4ebedf32dadd,To define how long data should be kept and when it should be deleted,Chính sách lưu giữ dữ liệu có mục đích gì?,- Category: Security Operations; Topics: Data Security,"* To define how long data should be kept and when it should be deleted: Xác định thời gian lưu giữ dữ liệu và thời điểm xóa dữ liệu\n- Chính sách lưu giữ dữ liệu quy định thời gian lưu giữ các loại dữ liệu khác nhau dựa trên nhu cầu kinh doanh, yêu cầu pháp lý và tuân thủ quy định. Chúng cũng xác định thời điểm dữ liệu cần được xóa một cách an toàn."
911d3ebb-fe6b-4c75-b926-60b4d9dbf27b,To define the access rights of subjects to objects in a structured format,Mục đích của ma trận kiểm soát truy cập là gì?,- Category: Access Controls; Topics: Access Controls,"* To define the access rights of subjects to objects in a structured format: Xác định quyền truy cập của các chủ thể vào các đối tượng theo định dạng có cấu trúc\n- Ma trận kiểm soát truy cập là một bảng xác định quyền truy cập của các chủ thể (người dùng, tiến trình) đối với các đối tượng (tệp, tài nguyên). Mỗi hàng đại diện cho một chủ thể, mỗi cột đại diện cho một đối tượng, và các ô chứa các quyền truy cập được cho phép."
b50fe5ff-847b-4b9d-b877-ee4e79c40b2d,"To ensure changes are authorized, tested, and documented before implementation",Mục tiêu chính của quản lý thay đổi trong hoạt động an ninh là gì?,- Category: Security Operations; Topics: Security Operations,"* To ensure changes are authorized, tested, and documented before implementation: Để đảm bảo các thay đổi được phê duyệt, kiểm tra và ghi lại trước khi thực hiện\n- Quản lý thay đổi đảm bảo rằng các sửa đổi đối với hệ thống được ủy quyền, kiểm thử, ghi chép và triển khai đúng cách với rủi ro tối thiểu. Nó ngăn chặn các thay đổi trái phép có thể gây ra lỗ hổng bảo mật hoặc lỗi hệ thống."
cb41b4a9-7619-4bbc-8062-d45165275d27,To ensure data cannot be recovered from discarded storage media,Mục tiêu chính của việc tiêu hủy an toàn các phương tiện lưu trữ dữ liệu là gì?,- Category: Security Operations; Topics: Data Security,"* To ensure data cannot be recovered from discarded storage media: Để đảm bảo dữ liệu không thể được khôi phục từ các phương tiện lưu trữ đã bị loại bỏ\n- Việc tiêu hủy phương tiện lưu trữ an toàn đảm bảo dữ liệu được xóa hoàn toàn khỏi phương tiện lưu trữ trước khi tiêu hủy, ngăn chặn việc khôi phục trái phép. Các phương pháp bao gồm khử từ, phá hủy vật lý và xóa mã hóa, tùy thuộc vào độ nhạy cảm của dữ liệu."
12cc9e86-6b45-41e7-aa92-3047d4991246,"To establish policies, standards, and procedures for managing security",Mục đích chính của các quy trình quản trị trong an ninh thông tin là gì?,- Category: Security Principles; Topics: Governance Ethics,"* To establish policies, standards, and procedures for managing security: Thiết lập các chính sách, tiêu chuẩn và quy trình để quản lý an ninh\n- Các quy trình quản trị thiết lập khuôn khổ để quản lý an ninh thông qua các chính sách, tiêu chuẩn, thủ tục và hướng dẫn. Chúng cung cấp định hướng và giám sát, trong khi việc triển khai kỹ thuật và giám sát là các hoạt động vận hành."
a89e1113-fcf7-488c-9232-1335145e5c9b,To hide sensitive data by replacing it with fictitious but realistic data,Che giấu dữ liệu được sử dụng để làm gì?,- Category: Security Operations; Topics: Data Security,"* To hide sensitive data by replacing it with fictitious but realistic data: Che giấu dữ liệu nhạy cảm bằng cách thay thế nó bằng dữ liệu giả nhưng trông rất thật\n- Che giấu dữ liệu (hay làm mờ dữ liệu) là phương pháp ẩn dữ liệu nhạy cảm bằng cách thay thế nó bằng dữ liệu giả nhưng có cấu trúc tương tự. Phương pháp này được sử dụng để bảo vệ dữ liệu trong môi trường phi sản xuất (kiểm thử, phát triển) trong khi vẫn duy trì định dạng dữ liệu và tính toàn vẹn tham chiếu."
29310183-f017-400a-988b-5df91561a82b,To host public-facing services while isolating them from the internal network,DMZ trong kiến ​​trúc mạng có mục đích gì?,- Category: Network Security; Topics: Network Security,"* To host public-facing services while isolating them from the internal network: Cung cấp các dịch vụ hướng đến người dùng công cộng đồng thời cách ly chúng khỏi mạng nội bộ\n- DMZ là một phân đoạn mạng nằm giữa mạng nội bộ và internet, lưu trữ các dịch vụ hướng ra công cộng (như máy chủ web) đồng thời cung cấp vùng đệm bảo vệ mạng nội bộ nếu các dịch vụ này bị xâm phạm."
11cc7de9-f3fd-4e8f-8730-1867b6e41958,To maintain ongoing awareness of security posture and detect changes,Mục tiêu chính của việc giám sát liên tục trong lĩnh vực an ninh là gì?,- Category: Security Principles; Topics: Governance Ethics,"* To maintain ongoing awareness of security posture and detect changes: Để duy trì nhận thức liên tục về tình hình an ninh và phát hiện các thay đổi\n- Giám sát liên tục duy trì nhận thức thường trực về tình trạng an ninh của tổ chức bằng cách thường xuyên đánh giá các biện pháp kiểm soát an ninh, lỗ hổng và mối đe dọa. Điều này cho phép phát hiện kịp thời các vấn đề an ninh và hỗ trợ việc ra quyết định dựa trên rủi ro."
80f85015-3eef-4e28-a556-754dd120db03,To monitor and control incoming and outgoing network traffic based on security rules,Chức năng chính của tường lửa trong bảo mật mạng là gì?,- Category: Network Security; Topics: Firewalls,"* To monitor and control incoming and outgoing network traffic based on security rules: Giám sát và kiểm soát lưu lượng mạng đến và đi dựa trên các quy tắc bảo mật\n- Tường lửa giám sát và lọc lưu lượng mạng dựa trên các quy tắc bảo mật được định sẵn, cho phép hoặc chặn lưu lượng để bảo vệ tài nguyên mạng. Tường lửa không mã hóa lưu lượng (đó là vai trò của mã hóa), không gán địa chỉ IP (vai trò của DHCP) hoặc không phân giải tên miền (vai trò của DNS)."
f3bba92e-2f18-4cdd-abe9-7c33a5adeb43,To protect against brute force attacks by disabling accounts after failed login attempts,Chính sách khóa tài khoản có mục đích gì?,- Category: Access Controls; Topics: Authentication,* To protect against brute force attacks by disabling accounts after failed login attempts: Để bảo vệ chống lại các cuộc tấn công vét cạn mật khẩu bằng cách vô hiệu hóa tài khoản sau các lần đăng nhập không thành công\n- Chính sách khóa tài khoản giúp bảo vệ chống lại các cuộc tấn công vét cạn bằng cách tạm thời hoặc vĩnh viễn vô hiệu hóa tài khoản sau một số lần đăng nhập không thành công nhất định. Điều này ngăn chặn kẻ tấn công liên tục thử các mật khẩu khác nhau
25e95b28-7c6b-46d5-b9b0-1799c7e58fbe,To provide a record of activities for accountability and investigation,Nhật ký kiểm toán có mục đích gì trong bảo mật thông tin?,- Category: Security Principles; Topics: Security Controls,"* To provide a record of activities for accountability and investigation: Cung cấp hồ sơ hoạt động để phục vụ mục đích giải trình và điều tra\n- Nhật ký kiểm toán (log) cung cấp bản ghi theo trình tự thời gian về các hoạt động của hệ thống, hành động của người dùng và các sự kiện bảo mật. Chúng hỗ trợ việc giải trình trách nhiệm, điều tra sự cố, đáp ứng các yêu cầu tuân thủ và phân tích pháp y."
ae6c535b-9fc7-4da1-83c4-93b59a89a0d8,"To provide authentication, integrity, and non-repudiation",Chữ ký điện tử có mục đích gì?,- Category: Security Operations; Topics: Data Security,"* To provide authentication, integrity, and non-repudiation: Nhằm đảm bảo tính xác thực, tính toàn vẹn và tính không thể chối bỏ\n- Chữ ký số sử dụng mật mã bất đối xứng để cung cấp tính xác thực (xác minh người gửi), tính toàn vẹn (phát hiện các sửa đổi) và tính không thể chối bỏ (ngăn người gửi phủ nhận việc họ đã gửi tin nhắn)."
d6f67e2e-6679-42d6-8fb3-d9fc8e462495,To provide encrypted communications between clients and servers,Mục đích chính của SSL/TLS là gì?,- Category: Network Security; Topics: Network Protocols,"* To provide encrypted communications between clients and servers: Cung cấp khả năng liên lạc được mã hóa giữa máy khách và máy chủ\n- SSL (Secure Sockets Layer) và phiên bản kế nhiệm TLS (Transport Layer Security) cung cấp khả năng mã hóa thông tin liên lạc giữa máy khách và máy chủ. Chúng đảm bảo tính bảo mật, toàn vẹn và xác thực cho dữ liệu được truyền qua mạng, thường được sử dụng cho HTTPS."
9f7d3f85-7251-4dd2-aaf7-4afcfb71da2f,To provide recommended practices that are not mandatory,Hướng dẫn trong quản trị an ninh có mục đích gì?,- Category: Security Principles; Topics: Governance Ethics,"* To provide recommended practices that are not mandatory: Cung cấp các khuyến nghị về thực hành nhưng không bắt buộc\n- Các hướng dẫn cung cấp các khuyến nghị về thực hành và lời khuyên nhưng không mang tính bắt buộc. Chính sách là các yêu cầu bắt buộc, tiêu chuẩn quy định cách đáp ứng các chính sách, và quy trình cung cấp hướng dẫn từng bước."
dc4ae735-47a7-490c-b7da-4aa72dd41749,To respond to and manage security incidents,Mục đích chính của CSIRT là gì?,- Category: BC DR IR; Topics: Incident Response,"* To respond to and manage security incidents: Để ứng phó và quản lý các sự cố an ninh\n- Nhóm ứng phó sự cố an ninh máy tính (CSIRT) chịu trách nhiệm tiếp nhận, phân tích và xử lý các sự cố an ninh. Họ điều phối việc xử lý sự cố, tiến hành điều tra pháp y và giúp ngăn ngừa các sự cố trong tương lai."
85e617d6-f864-4d71-8b09-a8dfc72ecade,To specify what objects a subject can access and what operations are permitted,Bảng năng lực trong kiểm soát truy cập có mục đích gì?,- Category: Access Controls; Topics: Access Controls,"* To specify what objects a subject can access and what operations are permitted: Để xác định những đối tượng mà một chủ thể có thể truy cập và những thao tác nào được cho phép\n- Bảng khả năng (gắn liền với một đối tượng) liệt kê các đối tượng mà đối tượng đó có thể truy cập và các thao tác được cho phép trên mỗi đối tượng. Nó là một giải pháp thay thế cho danh sách kiểm soát truy cập (ACL), vốn được gắn liền với các đối tượng."
d9323e77-e39b-4eaa-9333-321cac54ede0,To verify that users have only the access they need and remove unnecessary permissions,Mục đích của việc xem xét quyền truy cập định kỳ là gì?,- Category: Access Controls; Topics: Access Controls,* To verify that users have only the access they need and remove unnecessary permissions: Để xác minh rằng người dùng chỉ có quyền truy cập cần thiết và loại bỏ các quyền không cần thiết\n- Việc xem xét lại quyền truy cập định kỳ (còn gọi là chứng nhận lại hoặc xác thực lại) xác minh rằng người dùng có quyền truy cập phù hợp dựa trên trách nhiệm công việc hiện tại của họ. Điều này giúp xác định và loại bỏ các quyền không cần thiết hoặc quá mức có thể đã tích lũy theo thời gian.
b6810eac-d561-427d-af03-391f620327ec,Transmission Control Protocol (TCP),"Giao thức nào hoạt động ở lớp Vận chuyển và cung cấp khả năng truyền thông đáng tin cậy, hướng kết nối?",- Category: Network Security; Topics: Network Protocols,"* Transmission Control Protocol (TCP): Giao thức kiểm soát truyền tải\n- TCP (Transmission Control Protocol) hoạt động ở lớp Vận chuyển và cung cấp khả năng giao tiếp đáng tin cậy, hướng kết nối với chức năng kiểm tra lỗi và truyền lại. UDP là giao thức không hướng kết nối, IP hoạt động ở lớp Mạng, và ICMP được sử dụng cho mục đích chẩn đoán."
a38436da-5d14-4f55-8347-64eeaef2bb73,Two or more authentication factors from different categories,Xác thực đa yếu tố yêu cầu người dùng cung cấp:,- Category: Access Controls; Topics: Authentication,"* Two or more authentication factors from different categories: Hai hoặc nhiều yếu tố xác thực từ các danh mục khác nhau\n- Xác thực đa yếu tố (MFA) yêu cầu hai hoặc nhiều yếu tố xác thực từ các danh mục khác nhau: thứ bạn biết (mật khẩu), thứ bạn có (mã thông báo) hoặc thứ bạn là (sinh trắc học). Sử dụng hai mật khẩu thuộc cùng một danh mục không phải là MFA."
9d12f583-0922-43d2-9fa2-3d2dfef4ea32,User Behavior Analytics (UBA),Phương pháp bảo mật nào liên quan đến việc phân tích các mẫu hành vi người dùng để phát hiện các bất thường?,- Category: Security Operations; Topics: Security Operations,* User Behavior Analytics (UBA): Phân tích hành vi người dùng\n- Phân tích hành vi người dùng (UBA) sử dụng học máy và phân tích thống kê để thiết lập các tiêu chuẩn về hoạt động bình thường của người dùng và phát hiện các bất thường có thể cho thấy tài khoản bị xâm phạm hoặc các mối đe dọa nội bộ.
b7a65af8-0044-4ae8-9d62-5c47e0fdb687,Using a list of common passwords to attempt unauthorized access,Dictionary Attack là gì?,- Category: Access Controls; Topics: Authentication,"* Using a list of common passwords to attempt unauthorized access: Sử dụng danh sách các mật khẩu phổ biến để cố gắng truy cập trái phép\n- Tấn công bằng từ điển sử dụng danh sách các mật khẩu thường dùng, từ điển và các mật khẩu đã biết từ các vụ xâm nhập trước đó để cố gắng giành quyền truy cập trái phép. Phương pháp này hiệu quả hơn tấn công vét cạn vì nó thử các mật khẩu có khả năng xảy ra cao nhất trước."
99580818-8eaa-48e8-ae0d-4c0fc8edfd68,Using precomputed tables of password hashes to reverse hash values,Rainbow Table Attack là gì?,- Category: Access Controls; Topics: Authentication,"* Using precomputed tables of password hashes to reverse hash values: Sử dụng bảng băm mật khẩu đã được tính toán trước để đảo ngược giá trị băm\n- Tấn công bảng cầu vồng sử dụng các bảng được tính toán trước chứa các hàm băm mật khẩu và mật khẩu gốc tương ứng. Kẻ tấn công so sánh các hàm băm mật khẩu bị đánh cắp với bảng để tìm các kết quả trùng khớp, bỏ qua bước tính toán hàm băm trong quá trình tấn công."
f9efea4d-1c7c-494f-a6ea-dcc0cd4a7dc5,Using stolen username/password pairs from one breach to access accounts on other systems,Credential Stuffing là gì?,- Category: Access Controls; Topics: Authentication,"* Using stolen username/password pairs from one breach to access accounts on other systems: Sử dụng tên người dùng/mật khẩu bị đánh cắp từ một vụ xâm nhập để truy cập vào tài khoản trên các hệ thống khác\n- Tấn công nhồi nhét thông tin đăng nhập là một kiểu tấn công trong đó kẻ tấn công sử dụng các tổ hợp tên người dùng/mật khẩu bị đánh cắp từ một vụ rò rỉ dữ liệu để cố gắng đăng nhập vào các hệ thống khác, lợi dụng thói quen phổ biến là sử dụng lại mật khẩu trên nhiều dịch vụ khác nhau."
501f3e22-2940-453a-99f5-e9284b7c35e0,Wi-Fi Protected Access (WPA),Giao thức bảo mật không dây nào sử dụng TKIP để mã hóa?,- Category: Network Security; Topics: Network Security,"* Wi-Fi Protected Access (WPA): Bảo vệ truy cập Wi-Fi\n- WPA (Wi-Fi Protected Access) sử dụng TKIP (Temporal Key Integrity Protocol) để mã hóa, đây là một cải tiến so với WEP. WPA2 sử dụng AES, và WPA3 sử dụng các cơ chế bảo mật mạnh hơn. TKIP hiện được coi là lỗi thời và không nên sử dụng."
