id,answer,question,hint,desc
d336bd28-d9b9-4180-80a8-c6c7881c2aef,25.000,"Sử dụng công thức ALE = ARO × SLE, nếu SLE cho một vụ vi phạm dữ liệu là 50.000 đô la và Tỷ lệ xảy ra hàng năm ước tính (ARO) là 0,5 (một lần mỗi hai năm), thì Mức tổn thất dự kiến ​​hàng năm (ALE) là bao nhiêu?",,"- Category: Program Management; Topics: Risk Management\n\n- Mức tổn thất dự kiến ​​hàng năm (ALE) = Tỷ lệ xảy ra hàng năm (ARO) × Mức tổn thất dự kiến ​​đơn lẻ (SLE). Trong trường hợp này: ALE = 0,5 × 50.000 đô la = 25.000 đô la. Điều này có nghĩa là tổ chức nên dự kiến ​​mức tổn thất trung bình hàng năm là 25.000 đô la từ rủi ro này. ALE giúp chứng minh tính hiệu quả của các khoản đầu tư an ninh — bất kỳ biện pháp kiểm soát nào có chi phí dưới 25.000 đô la mỗi năm đều sẽ mang lại hiệu quả về chi phí."
34e47afe-e444-474a-8a5b-9f0a04069836,4624,Quản trị viên Windows cần điều tra khả năng leo thang đặc quyền. Nhà phân tích nên tìm ID Nhật ký Sự kiện Windows nào để tìm các sự kiện đăng nhập thành công?,,"- Category: Security Operations; Topics: Monitoring Alerting\n\n- Sự kiện ID 4624 của Windows ghi lại các sự kiện đăng nhập thành công, bao gồm loại đăng nhập, tên tài khoản và thông tin nguồn. Sự kiện ID 4625 cho biết các lần đăng nhập không thành công, 4720 cho biết việc tạo tài khoản người dùng và 1102 cho biết nhật ký kiểm tra đã bị xóa. Việc xem xét các sự kiện 4624 giúp xác định truy cập trái phép và leo thang đặc quyền."
4dcaa459-b090-4ec1-be1a-cfad214547b1,A fingerprint scan,"Câu nào sau đây là ví dụ về yếu tố xác thực ""something you are""?",* Quét dấu vân tay,"- Category: General Concepts; Topics: Authentication Authorization\n\n* A fingerprint scan: Quét dấu vân tay\n- Quét dấu vân tay là một yếu tố xác thực sinh trắc học, thuộc loại ""thứ bạn là"". Ba loại yếu tố xác thực chính là: thứ bạn biết (mật khẩu, mã PIN), thứ bạn có (thẻ thông minh, khóa bảo mật, mã thông báo) và thứ bạn là (sinh trắc học như dấu vân tay, quét võng mạc, nhận dạng khuôn mặt)."
9e778a4f-098b-46e4-925f-09fa13315b34,"A formal patch management process with testing, approval, and deployment timelines",Một phần mềm quét lỗ hổng bảo mật báo cáo rằng một số máy chủ thiếu các bản vá lỗi quan trọng được phát hành cách đây ba tháng. Nhóm CNTT cho biết họ đã trì hoãn việc vá lỗi vì lo ngại về khả năng tương thích của ứng dụng. Cần thực hiện quy trình nào để giải quyết vấn đề này?,"* Một quy trình quản lý bản vá chính thức với các mốc thời gian thử nghiệm, phê duyệt và triển khai","- Category: Security Operations; Topics: Endpoint Security\n\n* A formal patch management process with testing, approval, and deployment timelines: Một quy trình quản lý bản vá chính thức với các mốc thời gian thử nghiệm, phê duyệt và triển khai\n- Quy trình quản lý bản vá chính thức bao gồm việc thử nghiệm các bản vá trong môi trường phi sản xuất để xác minh khả năng tương thích, xin phê duyệt từ bộ phận quản lý thay đổi và triển khai trong khung thời gian xác định dựa trên mức độ nghiêm trọng. Quy trình này cân bằng giữa nhu cầu cập nhật bảo mật kịp thời với các vấn đề về tính ổn định của ứng dụng, đảm bảo rằng các bản vá quan trọng không bị trì hoãn vô thời hạn."
9a25de63-375f-4242-8e57-a57af2c5a67a,Acceptable Use Policy (AUP),Một tổ chức tạo ra một văn bản quy định các hành vi được chấp nhận đối với nhân viên khi sử dụng máy tính và truy cập internet của công ty. Văn bản này được gọi là gì?,* Chính sách sử dụng hợp lý,"- Category: Program Management; Topics: Security Awareness\n\n* Acceptable Use Policy (AUP): Chính sách sử dụng hợp lý\n- Chính sách sử dụng hợp lý (AUP) xác định các quy tắc và hành vi mà nhân viên cần tuân thủ khi sử dụng các nguồn lực của tổ chức, bao gồm máy tính, mạng, email và truy cập internet. Chính sách này thường bao gồm các hoạt động bị cấm, hướng dẫn sử dụng cá nhân, thông tin về việc giám sát và hậu quả đối với các vi phạm chính sách. AUP là những chính sách bảo mật cơ bản thiết lập các kỳ vọng về hành vi."
5c86e077-a431-4073-b23d-56a6a6036fbb,Aligning IT governance with business objectives,Việc triển khai khung COBIT giúp tổ chức đạt được mục tiêu chính nào?,* Đảm bảo quản trị CNTT phù hợp với mục tiêu kinh doanh,"- Category: Program Management; Topics: Governance Compliance\n\n* Aligning IT governance with business objectives: Đảm bảo quản trị CNTT phù hợp với mục tiêu kinh doanh\n- COBIT (Control Objectives for Information and Related Technologies) là một khung quản trị CNTT giúp các tổ chức điều chỉnh các hoạt động CNTT phù hợp với mục tiêu kinh doanh, quản lý rủi ro liên quan đến CNTT và đảm bảo tuân thủ. Khác với các khung kiểm soát kỹ thuật, COBIT tập trung vào quản trị và quản lý CNTT doanh nghiệp ở cấp chiến lược, thu hẹp khoảng cách giữa yêu cầu kinh doanh và triển khai kỹ thuật."
d2979cf3-4d6b-48ec-89c2-f240ebe18cc6,ARP poisoning,"Kẻ tấn công trên mạng cục bộ gửi các thông báo phản hồi ARP giả mạo để liên kết địa chỉ MAC của chúng với địa chỉ IP của cổng mặc định, khiến tất cả lưu lượng truy cập từ các máy chủ khác được chuyển hướng qua máy của kẻ tấn công. Đây là loại tấn công nào?",* Tấn công đầu độc ARP,"- Category: Threats Vulnerabilities; Topics: Attack Types\n\n* ARP poisoning: Tấn công đầu độc ARP\n- Tấn công đầu độc ARP (còn gọi là giả mạo ARP) khai thác tính chất không trạng thái của giao thức ARP bằng cách gửi các phản hồi ARP giả mạo. Vì ARP không xác thực phản hồi, các máy chủ trên mạng chấp nhận ánh xạ sai địa chỉ MAC của kẻ tấn công tới địa chỉ IP của cổng. Điều này chuyển hướng lưu lượng truy cập qua máy của kẻ tấn công, cho phép nghe lén hoặc sửa đổi dữ liệu. Kiểm tra ARP động (DAI) trên các thiết bị chuyển mạch là một biện pháp đối phó quan trọng."
42f3e579-eb7f-4c8b-a41f-b4112e849f1e,Authority and urgency,"Kẻ tấn công thuyết phục người dùng cài đặt ""bản cập nhật bảo mật trình duyệt bắt buộc"" bằng cách hiển thị cảnh báo giả mạo trên một trang web bị xâm nhập. Những nguyên tắc kỹ thuật xã hội nào CHÍNH được áp dụng trong trường hợp này?",* Quyền hạn và tính cấp bách,- Category: Threats Vulnerabilities; Topics: Social Engineering\n\n* Authority and urgency: Quyền hạn và tính cấp bách\n- Cuộc tấn công này lợi dụng uy tín (giả mạo trình duyệt hoặc nhà cung cấp bảo mật để trông có vẻ chính thức) và tính cấp bách (ngụ ý rằng cần cập nhật ngay lập tức vì lý do bảo mật). Hai nguyên tắc này kết hợp với nhau để bỏ qua khả năng tư duy phản biện — nạn nhân nhận thức thông điệp đến từ một cơ quan có thẩm quyền đáng tin cậy và cảm thấy bị áp lực phải hành động nhanh chóng. Người dùng cần được đào tạo để chỉ xác minh các bản cập nhật phần mềm thông qua các kênh chính thức.
f91cc674-afc9-4e70-9cab-45e060af22ca,Automated compliance monitoring through scripting,Một kịch bản PowerShell chạy hàng đêm để kiểm tra tất cả các tài khoản miền xem có mật khẩu nào chưa được thay đổi trong hơn 90 ngày hay không và tạo báo cáo cho nhóm bảo mật. Đây là một ví dụ về thực tiễn bảo mật nào?,* Giám sát tuân thủ tự động thông qua kịch bản,"- Category: Security Operations; Topics: Monitoring Alerting\n\n* Automated compliance monitoring through scripting: Giám sát tuân thủ tự động thông qua kịch bản\n- Giám sát tuân thủ tự động sử dụng các tập lệnh để thường xuyên kiểm tra hệ thống so với các chính sách và tiêu chuẩn bảo mật. Trong trường hợp này, tập lệnh PowerShell tự động hóa việc thực thi chính sách xoay vòng mật khẩu bằng cách xác định các tài khoản không tuân thủ. Cách tiếp cận này giảm thiểu công sức thủ công, đảm bảo kiểm tra nhất quán và cung cấp báo cáo kịp thời để khắc phục."
4536c5fc-0071-4099-a8c7-91f929d692b6,Automated incident response playbooks,Một tổ chức đang triển khai nền tảng SOAR. Khả năng nào phân biệt SOAR với hệ thống SIEM truyền thống?,* Sổ tay quy trình ứng phó sự cố tự động,"- Category: Security Operations; Topics: Monitoring Alerting\n\n* Automated incident response playbooks: Sổ tay quy trình ứng phó sự cố tự động\n- Các nền tảng SOAR (Security Orchestration, Automation, and Response) khác biệt với các hệ thống SIEM truyền thống bằng cách cung cấp các kịch bản ứng phó sự cố tự động. Trong khi SIEM tập trung vào thu thập nhật ký, tương quan và cảnh báo, SOAR bổ sung khả năng điều phối và tự động hóa có thể tự động thực hiện các hành động ứng phó được xác định trước, giảm thời gian phản hồi và khối lượng công việc của nhà phân tích"
c7b0f838-351a-4ff6-9af8-2fe89d88353e,Availability,"Một công ty thương mại điện tử triển khai các máy chủ web dự phòng, bộ cân bằng tải và cụm cơ sở dữ liệu để đảm bảo cửa hàng trực tuyến của họ vẫn hoạt động trong thời gian lưu lượng truy cập cao điểm và khi máy chủ gặp sự cố. Yếu tố nào trong bộ ba CIA là trọng tâm chính?",* Khả dụng,"- Category: General Concepts; Topics: CIA Triad\n\n* Availability: Khả dụng\n- Các máy chủ dự phòng, bộ cân bằng tải và cụm cơ sở dữ liệu đều tập trung vào tính khả dụng — đảm bảo rằng hệ thống và dữ liệu có thể truy cập được đối với người dùng được ủy quyền khi cần thiết. Những biện pháp này giúp bảo vệ chống lại thời gian ngừng hoạt động do lỗi phần cứng, lưu lượng truy cập tăng đột biến hoặc các sự cố khác có thể ngăn người dùng truy cập vào cửa hàng trực tuyến."
1711d155-f723-43b0-a8d1-70107419db8f,Black box (zero knowledge),"Một tổ chức thuê một công ty kiểm thử xâm nhập để thực hiện một bài kiểm tra mà trong đó các chuyên gia kiểm thử không được cung cấp bất kỳ thông tin nào về môi trường mục tiêu, mô phỏng một kẻ tấn công bên ngoài trong thế giới thực. Đây là loại kiểm thử xâm nhập nào?",* Hộp đen (không có thông tin),"- Category: Program Management; Topics: Security Awareness\n\n* Black box (zero knowledge): Hộp đen (không có thông tin)\n- Kiểm thử xâm nhập hộp đen (không có thông tin nội bộ) không cung cấp cho người kiểm thử bất kỳ thông tin nào về môi trường mục tiêu, chẳng hạn như sơ đồ mạng, mã nguồn hoặc thông tin đăng nhập. Cách tiếp cận này mô phỏng một kẻ tấn công bên ngoài không có kiến ​​thức nội bộ và kiểm tra khả năng phòng thủ của tổ chức từ góc nhìn bên ngoài. Kiểm thử hộp trắng cung cấp đầy đủ thông tin, còn kiểm thử hộp xám cung cấp một phần thông tin về môi trường."
cb905979-db64-42fc-9a6a-ac68db2ef756,Block the email and alert the security team,"Giải pháp DLP của công ty phát hiện một nhân viên đang cố gắng gửi một bảng tính chứa số An sinh Xã hội của khách hàng đến một địa chỉ email cá nhân. Theo các thực tiễn tốt nhất, hệ thống DLP nên thực hiện hành động gì?",* Chặn email đó và thông báo cho nhóm bảo mật,"- Category: Security Operations; Topics: Endpoint Security\n\n* Block the email and alert the security team: Chặn email đó và thông báo cho nhóm bảo mật\n- Khi giải pháp DLP phát hiện nỗ lực truyền dữ liệu nhạy cảm (số an sinh xã hội) đến một địa chỉ không được phép (email cá nhân), phương pháp tốt nhất là chặn quá trình truyền và cảnh báo cho nhóm bảo mật. Điều này ngăn chặn việc đánh cắp dữ liệu đồng thời cho phép nhóm bảo mật điều tra xem hành động đó là cố ý hay vô tình và thực hiện các biện pháp xử lý thích hợp."
bc000844-86ab-4529-81a9-58d9b25cf44c,Brute force attack,"Kẻ tấn công thử mọi tổ hợp ký tự có thể để bẻ khóa mật khẩu của người dùng. Với mật khẩu sáu ký tự, kẻ tấn công ước tính sẽ mất vài giờ để thử hết tất cả các khả năng. Đây là loại tấn công mật khẩu nào?",* Tấn công vét cạn,"- Category: Threats Vulnerabilities; Topics: Attack Types\n\n* Brute force attack: Tấn công vét cạn\n- Tấn công vét cạn (brute force attack) thử mọi tổ hợp ký tự có thể cho đến khi tìm thấy mật khẩu chính xác. Đây là phương pháp bẻ khóa mật khẩu kỹ lưỡng nhất nhưng cũng chậm nhất. Thời gian cần thiết phụ thuộc vào độ dài và độ phức tạp của mật khẩu — mỗi ký tự bổ sung sẽ làm tăng số lượng tổ hợp theo cấp số nhân. Các chính sách khóa tài khoản, giới hạn tốc độ truy cập và mật khẩu dài, phức tạp là những biện pháp đối phó hiệu quả."
982648ab-e35d-44b3-9bee-ba4a3d2215c1,Capture volatile data (RAM contents) before powering down,"Một điều tra viên pháp y đến hiện trường, nơi một chiếc máy tính bị nghi ngờ chứa bằng chứng vẫn đang bật. Điều đầu tiên mà điều tra viên nên làm là gì?",* Ghi lại dữ liệu tạm thời (nội dung RAM) trước khi tắt nguồn,"- Category: Security Operations; Topics: Digital Forensic\n\n* Capture volatile data (RAM contents) before powering down: Ghi lại dữ liệu tạm thời (nội dung RAM) trước khi tắt nguồn\n- Khi hệ thống vẫn đang hoạt động, điều tra viên nên thu thập dữ liệu dễ thay đổi trước tiên, đặc biệt là nội dung RAM, vì dữ liệu này sẽ bị mất khi hệ thống tắt nguồn. RAM có thể chứa các khóa mã hóa, các tiến trình đang chạy, kết nối mạng và các bằng chứng quan trọng khác. Thứ tự độ dễ thay đổi quy định rằng dữ liệu dễ thay đổi nhất (thanh ghi, bộ nhớ đệm, RAM) nên được thu thập trước."
74841d13-921a-4398-a180-323ebd781ec5,Certificate Authority (CA),"Trong cơ sở hạ tầng khóa công khai (PKI), thực thể nào chịu trách nhiệm phát hành và ký các chứng chỉ số?",* Cơ quan cấp chứng chỉ,"- Category: Security Architecture; Topics: PKI\n\n* Certificate Authority (CA): Cơ quan cấp chứng chỉ\n- Cơ quan cấp chứng chỉ (CA) là thực thể đáng tin cậy trong cơ sở hạ tầng khóa công khai (PKI) chịu trách nhiệm phát hành, ký và quản lý chứng chỉ số. CA xác minh danh tính của người yêu cầu chứng chỉ và ký điện tử các chứng chỉ bằng khóa riêng của mình, thiết lập chuỗi tin cậy. Cơ quan đăng ký (RA) hỗ trợ CA bằng cách xử lý việc xác minh danh tính, nhưng chỉ có CA mới thực sự ký và phát hành chứng chỉ."
42181605-7f12-4ee3-a087-17b0e1d5b6df,CIS Controls are prioritized and provide a practical starting point for improving security,Các tiêu chuẩn kiểm soát CIS cung cấp một tập hợp các thực tiễn bảo mật tốt nhất được ưu tiên. Lợi thế CHÍNH của việc triển khai các tiêu chuẩn kiểm soát CIS so với một khuôn khổ toàn diện như NIST 800-53 là gì?,* Các biện pháp kiểm soát CIS được ưu tiên và cung cấp điểm khởi đầu thiết thực để cải thiện an ninh,"- Category: Program Management; Topics: Governance Compliance\n\n* CIS Controls are prioritized and provide a practical starting point for improving security: Các biện pháp kiểm soát CIS được ưu tiên và cung cấp điểm khởi đầu thiết thực để cải thiện an ninh\n- Các biện pháp kiểm soát CIS được sắp xếp theo mức độ ưu tiên (Nhóm triển khai 1, 2, 3), cung cấp điểm khởi đầu thiết thực và khả thi cho các tổ chức để cải thiện tư thế bảo mật của mình. Không giống như NIST 800-53, cung cấp một danh mục toàn diện các biện pháp kiểm soát, các biện pháp kiểm soát CIS tập trung vào các hành động có tác động lớn nhất trước tiên, điều này làm cho chúng đặc biệt hữu ích cho các tổ chức có nguồn lực bảo mật hạn chế."
f9b6f560-0b96-4338-a471-77f45b03a665,Client-side encryption with customer-managed keys,"Một tổ chức đang chuyển sang sử dụng nhà cung cấp dịch vụ đám mây công cộng và muốn đảm bảo rằng các khóa mã hóa được quản lý hoàn toàn bởi tổ chức đó, chứ không phải bởi nhà cung cấp dịch vụ đám mây. Họ nên áp dụng phương pháp nào?",* Mã hóa phía máy khách với khóa do khách hàng quản lý,"- Category: Security Architecture; Topics: Cloud Security\n\n* Client-side encryption with customer-managed keys: Mã hóa phía máy khách với khóa do khách hàng quản lý\n- Mã hóa phía máy khách với khóa do khách hàng quản lý (còn được gọi là Bring Your Own Key hoặc BYOK) đảm bảo tổ chức giữ toàn quyền kiểm soát các khóa mã hóa. Dữ liệu được mã hóa trước khi gửi đến nhà cung cấp dịch vụ đám mây, có nghĩa là nhà cung cấp không bao giờ có quyền truy cập vào dữ liệu gốc hoặc các khóa được sử dụng để bảo vệ dữ liệu đó."
bd0641a3-a77d-41ba-a730-74b9fc6ac485,Cloud Access Security Broker (CASB),"Một tổ chức triển khai một giải pháp nằm giữa người dùng và dịch vụ đám mây để thực thi các chính sách bảo mật, giám sát hoạt động và ngăn ngừa mất dữ liệu trên tất cả các ứng dụng đám mây. Giải pháp này thuộc loại nào?",* Giải pháp bảo mật truy cập đám mây,"- Category: Security Architecture; Topics: Cloud Security\n\n* Cloud Access Security Broker (CASB): Giải pháp bảo mật truy cập đám mây\n- Giải pháp bảo mật truy cập đám mây (Cloud Access Security Broker - CASB) là một giải pháp bảo mật nằm giữa người dùng và nhà cung cấp dịch vụ đám mây. CASB thực thi các chính sách bảo mật như xác thực, ủy quyền, đăng nhập một lần (SSO), mã hóa, mã hóa token, ghi nhật ký, cảnh báo và phát hiện phần mềm độc hại trên các dịch vụ đám mây. Chúng cung cấp khả năng hiển thị về việc sử dụng đám mây (bao gồm cả CNTT bóng tối), đảm bảo tuân thủ và bảo vệ dữ liệu trên các môi trường SaaS, PaaS và IaaS."
cf9b2fc1-09ef-45a3-92c3-041eac9dd5ae,Cloud Security Posture Management (CSPM),"Nhóm bảo mật đám mây sử dụng một công cụ tự động liên tục giám sát cấu hình cơ sở hạ tầng đám mây so với các thực tiễn bảo mật tốt nhất, xác định các cấu hình sai như các thùng S3 mở hoặc các chính sách IAM quá lỏng lẻo. Công cụ này thuộc loại nào?",* Quản lý hình thức bảo mật đám mây,"- Category: Security Architecture; Topics: Cloud Security\n\n* Cloud Security Posture Management (CSPM): Quản lý hình thức bảo mật đám mây\n- Các công cụ quản lý hình thức bảo mật đám mây (CSPM) liên tục giám sát môi trường đám mây để phát hiện các cấu hình bảo mật sai, vi phạm tuân thủ và sai lệch so với các thực tiễn tốt nhất. Các giải pháp CSPM có thể tự động phát hiện các vấn đề như các thùng lưu trữ có thể truy cập công khai, vai trò IAM quá lỏng lẻo, cơ sở dữ liệu không được mã hóa và cấu hình ghi nhật ký bị thiếu. Nhiều công cụ CSPM cũng cung cấp khả năng khắc phục tự động."
4dbdad2d-7a60-4861-b89b-b35d67e09a13,Conditional access (compliance-based access control),"Chính sách MDM yêu cầu tất cả các thiết bị được quản lý phải có phiên bản hệ điều hành tối thiểu, bật khóa màn hình và mã hóa. Nếu một thiết bị không tuân thủ, nó sẽ tự động bị chặn truy cập vào email của công ty. Phương pháp thực thi này được gọi là gì?",* Quyền truy cập có điều kiện (kiểm soát truy cập dựa trên sự tuân thủ),"- Category: Security Operations; Topics: Endpoint Security\n\n* Conditional access (compliance-based access control): Quyền truy cập có điều kiện (kiểm soát truy cập dựa trên sự tuân thủ)\n- Quyền truy cập có điều kiện (còn gọi là kiểm soát truy cập dựa trên sự tuân thủ) đánh giá trạng thái tuân thủ của thiết bị so với các chính sách đã định trước khi cấp quyền truy cập vào tài nguyên của công ty. Nếu thiết bị không đáp ứng các yêu cầu tối thiểu (phiên bản hệ điều hành, mã hóa, khóa màn hình), quyền truy cập sẽ tự động bị từ chối hoặc hạn chế cho đến khi thiết bị được đưa về trạng thái tuân thủ."
50c61d7e-3905-478e-9176-dc5c10df866f,Confidentiality,Một bệnh viện mã hóa tất cả hồ sơ bệnh nhân được lưu trữ trong cơ sở dữ liệu của mình để đảm bảo chỉ có nhân viên y tế được ủy quyền mới có thể đọc thông tin. Yếu tố nào trong bộ ba CIA mà việc này bảo vệ chủ yếu?,* Bảo mật,"- Category: General Concepts; Topics: CIA Triad\n\n* Confidentiality: Bảo mật\n- Mã hóa hồ sơ bệnh nhân chủ yếu nhằm bảo vệ tính bảo mật, đảm bảo rằng thông tin chỉ có thể được truy cập bởi những người được ủy quyền. Bằng cách mã hóa dữ liệu khi lưu trữ, ngay cả khi người không được ủy quyền truy cập vào các tệp cơ sở dữ liệu, họ cũng không thể đọc được thông tin bệnh nhân thực tế nếu không có khóa giải mã thích hợp."
058279e4-dd78-40f6-899c-f7e7cad011f4,Confidentiality,Một công ty triển khai phần mềm ngăn ngừa mất dữ liệu (DLP) để ngăn nhân viên gửi các tệp chứa số An sinh Xã hội đến các địa chỉ bên ngoài. Phần mềm này chủ yếu bảo vệ yếu tố nào trong bộ ba CIA?,* Bảo mật,"- Category: General Concepts; Topics: CIA Triad\n\n* Confidentiality: Bảo mật\n- Phần mềm DLP ngăn chặn việc truyền tải dữ liệu nhạy cảm như số an sinh xã hội cho người nhận bên ngoài, chủ yếu nhằm bảo vệ tính bảo mật. Bằng cách ngăn chặn việc tiết lộ trái phép thông tin nhận dạng cá nhân (PII), giải pháp DLP đảm bảo dữ liệu nhạy cảm chỉ được truy cập bởi các bên được ủy quyền trong tổ chức."
