id,answer,question,hint,desc
a6881709-6a55-4378-b88c-0f39abc5d952,"Application awareness, integrated IPS, and threat intelligence feeds",Tường lửa thế hệ mới (NGFW) khác với tường lửa trạng thái truyền thống vì nó bao gồm những khả năng nào sau đây?,- CompTIA Security+ (SY0-701),"* Application awareness, integrated IPS, and threat intelligence feeds: Nhận biết ứng dụng, IPS tích hợp và nguồn cấp dữ liệu tình báo về mối đe dọa\n- Tường lửa thế hệ tiếp theo (NGFW) mở rộng khả năng của tường lửa trạng thái truyền thống bằng cách bổ sung khả năng kiểm tra gói tin chuyên sâu, nhận biết ứng dụng (xác định và kiểm soát ứng dụng bất kể cổng nào), tích hợp ngăn chặn xâm nhập (IPS), nguồn cấp dữ liệu tình báo về mối đe dọa và thường cả kiểm tra SSL/TLS. NGFW có thể đưa ra quyết định dựa trên ứng dụng đang được sử dụng chứ không chỉ dựa vào số cổng, cung cấp khả năng kiểm soát an ninh chi tiết hơn nhiều."
c7fca6bf-a544-4ea0-a2a7-41c3508c52ee,"It enables content filtering, logging, and caching of outbound web requests",Một tổ chức sử dụng máy chủ proxy chuyển tiếp cho tất cả lưu lượng truy cập internet đi ra từ các máy trạm của nhân viên. Lợi ích bảo mật nào sau đây là của cấu hình này?,- CompTIA Security+ (SY0-701),"* It enables content filtering, logging, and caching of outbound web requests: Nó cho phép lọc nội dung, ghi nhật ký và lưu vào bộ nhớ đệm các yêu cầu web gửi đi.\n- Máy chủ proxy chuyển tiếp đóng vai trò trung gian giữa các máy khách nội bộ và máy chủ bên ngoài. Lợi ích về bảo mật bao gồm lọc nội dung (chặn truy cập vào các trang web độc hại hoặc bị cấm), ghi nhật ký toàn bộ lưu lượng truy cập web cho mục đích kiểm toán và điều tra, lưu trữ nội dung được truy cập thường xuyên để giảm băng thông và thực thi các chính sách sử dụng hợp lý. Proxy cũng có thể che giấu địa chỉ IP nội bộ khỏi các máy chủ bên ngoài."
addf791a-fd00-4359-a62b-0b2f1165e3a5,Virtual Local Area Network,Một quản trị viên mạng tách biệt phòng kế toán và phòng kỹ thuật bằng cách sử dụng các mạng ảo khác nhau trên cùng một thiết bị chuyển mạch vật lý. Công nghệ nào đang được sử dụng?,- CompTIA Security+ (SY0-701),"* Virtual Local Area Network (VLAN): Mạng cục bộ ảo\n- Mạng cục bộ ảo (VLAN) phân chia mạng vật lý thành các miền phát sóng riêng biệt ở lớp 2. Mỗi VLAN hoạt động như một mạng độc lập, ngay cả khi các thiết bị có thể dùng chung cơ sở hạ tầng chuyển mạch vật lý. VLAN cải thiện bảo mật bằng cách cô lập lưu lượng mạng giữa các phòng ban, hạn chế phạm vi lưu lượng phát sóng và cung cấp nền tảng để áp dụng các chính sách kiểm soát truy cập giữa các phân đoạn."
aa8c2f9b-e706-4462-b9fc-8e017c4a6c57,Virtual Private Network,Các nhân viên làm việc từ xa của một công ty kết nối với mạng nội bộ thông qua một đường hầm mã hóa trên internet. Công nghệ nào đang được sử dụng?,- CompTIA Security+ (SY0-701),"* Virtual Private Network (VPN): Mạng riêng ảo\n- Mạng riêng ảo (VPN) tạo ra một đường hầm mã hóa trên mạng công cộng (internet) để cung cấp quyền truy cập từ xa an toàn vào mạng doanh nghiệp. VPN truy cập từ xa cho phép người dùng cá nhân kết nối từ bất cứ đâu, trong khi VPN kết nối giữa các địa điểm (site-to-site VPN) kết nối toàn bộ mạng với nhau. VPN thường sử dụng các giao thức như IPSec hoặc SSL/TLS để mã hóa lưu lượng truy cập và bảo vệ tính bảo mật và toàn vẹn dữ liệu trong quá trình truyền tải."
881229b3-b32d-4546-9dbc-0cdbf5f4d268,Web Application Firewall,"Một tổ chức triển khai một thiết bị bảo mật kiểm tra lưu lượng HTTP và HTTPS đến các ứng dụng web, chặn các nỗ lực tấn công SQL injection và XSS. Thiết bị này thuộc loại nào?",- CompTIA Security+ (SY0-701),"* Web Application Firewall (WAF): Tường lửa ứng dụng web\n- Tường lửa ứng dụng web (WAF) hoạt động ở lớp 7 (lớp ứng dụng) và được thiết kế đặc biệt để bảo vệ các ứng dụng web bằng cách kiểm tra lưu lượng HTTP/HTTPS. Nó lọc, giám sát và chặn lưu lượng truy cập web độc hại, bao gồm cả các cuộc tấn công SQL injection, XSS và các cuộc tấn công khác nằm trong danh sách OWASP Top 10. Không giống như các tường lửa truyền thống hoạt động ở lớp 3-4, WAF hiểu các giao thức ứng dụng web và có thể phân tích nội dung yêu cầu."
