id,answer,question,hint,desc
673dc7f8-6599-4fd8-bbc2-a7bdfc541c26,Key card to enter a building,Câu nào sau đây là một ví dụ về kiểm soát truy cập vật lý?,- Category: Access Controls; Topics: Access Controls,"* Key card to enter a building: Thẻ khóa để vào tòa nhà\n- Thẻ ra vào tòa nhà là hình thức kiểm soát truy cập vật lý vì chúng hạn chế việc ra vào trực tiếp các cơ sở. Tên người dùng/mật khẩu, mã hóa và quyền hạn dựa trên vai trò là các hình thức kiểm soát logic/kỹ thuật."
35ce2928-5592-4856-974b-cad6b4fd9b9e,Limiting the spread of attacks by isolating network zones,Lợi ích bảo mật chính của việc phân đoạn mạng là gì?,- Category: Network Security; Topics: Network Security,"* Limiting the spread of attacks by isolating network zones: Hạn chế sự lây lan của các cuộc tấn công bằng cách cô lập các vùng mạng\n- Phân đoạn mạng chia mạng thành các phân đoạn hoặc vùng riêng biệt, hạn chế sự lây lan của các cuộc tấn công. Nếu một phân đoạn bị xâm phạm, việc phân đoạn giúp ngăn chặn sự lây lan sang các phân đoạn khác. Nó cũng cho phép kiểm soát an ninh chi tiết hơn."
bfbf578b-3df9-48dd-8192-309c9df00d6b,Man-in-the-Middle (MitM),Loại tấn công nào liên quan đến việc chặn bắt thông tin liên lạc giữa hai bên mà không có sự cho phép của họ?,- Category: Network Security; Topics: Network Attacks,* Man-in-the-Middle (MitM): Kẻ nghe lén\n- Tấn công Man-in-the-Middle (MitM) liên quan đến việc kẻ tấn công bí mật chặn bắt và có thể thay đổi thông tin liên lạc giữa hai bên tin rằng họ đang liên lạc trực tiếp với nhau.
1d5ce9b7-511a-49bd-a0e3-d5ecd35a8891,Multi-Factor Authentication,Phương pháp xác thực nào sau đây là AN TOÀN NHẤT?,- Category: Access Controls; Topics: Authentication,"Multi-Factor Authentication (MFA): Xác thực đa yếu tố\n- Xác thực đa yếu tố (MFA) là phương pháp bảo mật nhất vì nó yêu cầu hai hoặc nhiều yếu tố xác thực khác nhau (thứ bạn biết, sở hữu hoặc là). Nó cung cấp khả năng bảo vệ mạnh mẽ hơn so với xác thực một yếu tố hoặc thậm chí xác thực hai yếu tố cơ bản."
76797dc1-a64e-448f-990e-96be9ee46658,Next-Generation Firewall (NGFW),"Thiết bị bảo mật nào kiểm tra cả lưu lượng mạng đến và đi, đồng thời có thể chặn các mối đe dọa dựa trên chữ ký và hành vi?",- Category: Network Security; Topics: Firewalls,"* Next-Generation Firewall (NGFW): Tường lửa thế hệ mới\n- Tường lửa thế hệ mới (NGFW) cung cấp các khả năng tiên tiến vượt trội so với tường lửa truyền thống, bao gồm kiểm tra gói tin chuyên sâu, ngăn chặn xâm nhập, kiểm soát cấp ứng dụng và thu thập thông tin tình báo về mối đe dọa. Chúng có thể phát hiện và chặn các mối đe dọa dựa trên chữ ký và phân tích hành vi."
1e9340de-040d-4c83-8642-450f23f09555,NIDS monitors network traffic; HIDS monitors activities on a single host,Sự khác biệt giữa hệ thống phát hiện xâm nhập dựa trên mạng (network-based IDS) và hệ thống phát hiện xâm nhập dựa trên máy chủ (host-based IDS) là gì?,- Category: Network Security; Topics: Network Security,"* NIDS monitors network traffic; HIDS monitors activities on a single host: NIDS giám sát lưu lượng mạng; HIDS giám sát các hoạt động trên một máy chủ duy nhất\n- Hệ thống phát hiện xâm nhập dựa trên mạng (NIDS) giám sát lưu lượng mạng để tìm kiếm các mẫu đáng ngờ, trong khi hệ thống phát hiện xâm nhập dựa trên máy chủ (HIDS) giám sát các hoạt động trên một máy chủ duy nhất, chẳng hạn như các lệnh gọi hệ thống, tệp nhật ký và các sửa đổi tệp. Chúng bổ sung cho nhau để phát hiện toàn diện."
6987e623-d82e-4943-9103-f1847f2a802b,Open Design,Nguyên tắc bảo mật nào nêu rõ rằng bảo mật không nên dựa vào việc giữ bí mật về thiết kế hoặc triển khai?,- Category: Security Principles; Topics: Security Controls,"* Open Design: Thiết kế mở\n- Nguyên tắc thiết kế mở khẳng định rằng bảo mật không nên phụ thuộc vào tính bí mật của thiết kế hoặc triển khai. Thay vào đó, bảo mật nên dựa vào độ mạnh của khóa và mật khẩu. Điều này trái ngược với ""bảo mật thông qua sự che giấu""."
41df6606-2c96-4c7b-a88f-e1519ecc18d8,Penetration Testing,Hoạt động bảo mật nào bao gồm việc mô phỏng các cuộc tấn công để xác định các lỗ hổng trước khi các tác nhân độc hại có thể khai thác chúng?,- Category: Security Operations; Topics: Security Operations,"* Penetration Testing: Kiểm thử xâm nhập\n- Kiểm thử xâm nhập (hack đạo đức) bao gồm các cuộc tấn công mô phỏng được ủy quyền để xác định và khai thác các lỗ hổng, chứng minh cách kẻ tấn công có thể truy cập. Nó vượt xa việc chỉ quét lỗ hổng bằng cách thực sự khai thác các điểm yếu đã được phát hiện."
fd331a8b-dda6-40ac-8567-8e9374428d9e,Ping Flood,Cuộc tấn công nào liên quan đến việc làm ngập mạng bằng các yêu cầu phản hồi ICMP không được phép?,- Category: Network Security; Topics: Network Attacks,"- Tấn công ping flood là một loại tấn công từ chối dịch vụ (DoS) làm ngập mục tiêu bằng các gói yêu cầu phản hồi ICMP (ping), tiêu tốn băng thông và tài nguyên hệ thống. Tấn công SYN flood vào các kết nối TCP của mục tiêu, tấn công giả mạo ARP thao túng bảng ARP, và tấn công làm hỏng dữ liệu bộ nhớ cache DNS."
22ebd414-9bc0-4390-9f9c-f3ac2b462b6b,Post-Incident Activity,"Trong giai đoạn nào của quá trình ứng phó sự cố, các nhà điều tra sẽ phân tích nhật ký để xác định nguyên nhân gốc rễ?",- Category: BC DR IR; Topics: Incident Response,"* Post-Incident Activity: Hoạt động sau sự cố\n- Giai đoạn hoạt động sau sự cố (còn gọi là giai đoạn rút kinh nghiệm) bao gồm việc phân tích những gì đã xảy ra, xác định nguyên nhân gốc rễ, ghi lại các phát hiện và thực hiện các biện pháp cải tiến. Điều này diễn ra sau khi sự cố đã được khống chế và loại bỏ."
688e3a3e-7793-4d41-ab4c-f954feeed0aa,Recovery Point Objective,"Trong kế hoạch phục hồi sau thảm họa, RPO là viết tắt của từ gì?",- Category: BC DR IR; Topics: Disaster Recovery,"- Recovery Point Objective (RPO): Mục tiêu điểm phục hồi\n- RPO là viết tắt của Recovery Point Objective (Mục tiêu điểm phục hồi), xác định mức độ mất dữ liệu tối đa có thể chấp nhận được tính bằng thời gian. Nó quyết định tần suất sao lưu dữ liệu cần thực hiện. Ví dụ, RPO 1 giờ có nghĩa là không được phép mất quá 1 giờ dữ liệu."
0437f057-af57-4900-a865-87d12e73cb33,Regularly updating software to fix vulnerabilities and bugs,Quản lý bản vá bao gồm những gì?,- Category: Security Operations; Topics: Security Hardening,"* Regularly updating software to fix vulnerabilities and bugs: Thường xuyên cập nhật phần mềm để khắc phục các lỗ hổng và lỗi\n- Quản lý bản vá là quá trình thu thập, kiểm thử và cài đặt các bản vá phần mềm (cập nhật) để khắc phục các lỗ hổng bảo mật, lỗi và cải thiện chức năng. Điều này rất cần thiết để duy trì an ninh hệ thống."
25c62438-75b4-49ae-873b-8ffbb1cfb9ab,Repeater,Thiết bị mạng nào mở rộng mạng bằng cách lặp lại tín hiệu giữa các phân đoạn?,- Category: Network Security; Topics: Network Protocols,* Repeater: Bộ lặp\n- Bộ lặp là thiết bị lớp 1 có chức năng tái tạo và khuếch đại tín hiệu để mở rộng phạm vi truyền tín hiệu trên một đoạn mạng. Nó không lọc lưu lượng truy cập hoặc đưa ra các quyết định định tuyến thông minh.
5f8d1b44-cf08-48a0-8605-7fffe1af6b96,Requiring two people to perform a sensitive operation together,Câu nào sau đây là một ví dụ về kiểm soát kép?,- Category: Security Principles; Topics: Security Controls,"* Requiring two people to perform a sensitive operation together: Yêu cầu hai người cùng thực hiện một thao tác nhạy cảm\n- Kiểm soát kép yêu cầu hai cá nhân được ủy quyền thực hiện đồng thời một thao tác nhạy cảm, chẳng hạn như mở két sắt hoặc phê duyệt một giao dịch tài chính lớn. Điều này khác với phân công nhiệm vụ (chia công việc) và xác thực hai yếu tố (xác minh danh tính)."
8fad2272-3d76-420c-a33d-ff6bb92f2d4b,Risk Acceptance,Chiến lược xử lý rủi ro nào liên quan đến việc quyết định rằng chi phí giảm thiểu rủi ro vượt quá tổn thất tiềm tàng?,- Category: Security Principles; Topics: Risk Management,"* Risk Acceptance: Chấp nhận rủi ro\n- Chấp nhận rủi ro xảy ra khi một tổ chức quyết định chấp nhận rủi ro mà không thực hiện các biện pháp kiểm soát, thường là vì chi phí giảm thiểu rủi ro vượt quá tác động tiềm tàng của rủi ro hoặc xác suất xảy ra rất thấp. Đây là một quyết định có ý thức và được ghi lại."
4b629941-df21-442f-b254-6f1aeb9def74,Risk Assessment,"Trong quản lý rủi ro, thuật ngữ nào mô tả quá trình xác định và đánh giá các mối đe dọa tiềm tàng đối với một tổ chức?",- Category: Security Principles; Topics: Risk Management,"* Risk Assessment: Đánh giá rủi ro\n- Đánh giá rủi ro là quá trình xác định các mối đe dọa tiềm tàng, điểm yếu, cũng như khả năng xảy ra và tác động của rủi ro. Giảm thiểu rủi ro là việc làm giảm rủi ro, chuyển giao rủi ro là việc dịch chuyển rủi ro (giống như bảo hiểm), và chấp nhận rủi ro là việc thừa nhận nhưng không giải quyết rủi ro."
7bb37ea2-2e7b-4d11-baea-6c8f7b305c80,Risk Mitigation,Chiến lược xử lý rủi ro nào bao gồm việc thực hiện các biện pháp bảo vệ để giảm khả năng xảy ra hoặc tác động của rủi ro?,- Category: Security Principles; Topics: Risk Management,"* Risk Mitigation: Giảm thiểu rủi ro\n- Giảm thiểu rủi ro bao gồm việc triển khai các biện pháp kiểm soát và bảo vệ để giảm khả năng xảy ra hoặc tác động của rủi ro. Ví dụ như cài đặt tường lửa, triển khai mã hóa hoặc thiết lập các quy trình sao lưu."
02b5dd05-7ed1-4389-8575-7da93b33827e,Role-Based Access Control (RBAC),Mô hình kiểm soát truy cập nào được sử dụng phổ biến nhất trong các tổ chức thương mại để quản lý quyền truy cập của nhân viên?,- Category: Access Controls; Topics: Access Controls,"* Role-Based Access Control (RBAC): Kiểm soát truy cập dựa trên vai trò\n- RBAC là mô hình kiểm soát truy cập được sử dụng phổ biến nhất trong các tổ chức thương mại vì nó liên kết quyền hạn với vai trò công việc, đơn giản hóa việc quản trị và có khả năng mở rộng tốt. Người dùng được chỉ định vai trò dựa trên trách nhiệm của họ."
01a14636-d014-40aa-b247-d58327688f82,Security awareness training program,Câu nào sau đây là một ví dụ về biện pháp kiểm soát an ninh hành chính?,- Category: Security Principles; Topics: Security Controls,"* Security awareness training program: Chương trình đào tạo nâng cao nhận thức về an ninh\n- Các biện pháp kiểm soát hành chính là các biện pháp kiểm soát dựa trên chính sách, quy trình hoặc đào tạo. Đào tạo nâng cao nhận thức về an ninh là một biện pháp kiểm soát hành chính. Mã hóa là một biện pháp kiểm soát kỹ thuật, hệ thống sinh trắc học là biện pháp kiểm soát kỹ thuật, và hệ thống chữa cháy là một biện pháp kiểm soát vật lý."
d6b5234e-ff65-48ed-9b40-eef58ddaeb02,Security Information and Event Management (SIEM),Hoạt động bảo mật nào bao gồm việc giám sát và phản hồi các sự kiện bảo mật trong thời gian thực?,- Category: Security Operations; Topics: Security Operations,"* Security Information and Event Management (SIEM): Quản lý thông tin và sự kiện an ninh\n- Hệ thống SIEM (Quản lý thông tin và sự kiện bảo mật) thu thập, tổng hợp và phân tích các sự kiện bảo mật từ nhiều nguồn khác nhau trong thời gian thực để phát hiện các mối đe dọa và cho phép phản ứng nhanh chóng. Chúng cung cấp khả năng hiển thị tập trung về tình trạng bảo mật."
bc5730ca-c14c-4ac4-abc7-8e687e8af625,Security Policy Documents,Câu nào sau đây là một ví dụ về bằng chứng hành chính trong một cuộc điều tra an ninh?,- Category: Security Principles; Topics: Governance Ethics,"- Security Policy Documents: Tài liệu chính sách bảo mật\n- Bằng chứng hành chính bao gồm các tài liệu như chính sách, quy trình, tiêu chuẩn và hồ sơ đào tạo. Ảnh chụp ổ cứng, bản ghi gói dữ liệu và bản sao bộ nhớ là các loại bằng chứng kỹ thuật hoặc vật lý."
d42e4248-d0c0-4b4c-bae2-f5f1fde6b614,Sending falsified ARP messages to link the attacker's MAC address with another IP address,ARP Spoofing là gì?,- Category: Network Security; Topics: Network Attacks,* Sending falsified ARP messages to link the attacker's MAC address with another IP address: Gửi các thông báo ARP giả mạo để liên kết địa chỉ MAC của kẻ tấn công với một địa chỉ IP khác\n- Tấn công giả mạo ARP (hay tấn công đầu độc ARP) liên quan đến việc gửi các thông điệp ARP giả mạo để liên kết địa chỉ MAC của kẻ tấn công với địa chỉ IP của thiết bị khác. Điều này có thể chuyển hướng lưu lượng truy cập qua máy của kẻ tấn công để chặn hoặc sửa đổi.
86587365-0de6-4a69-aa2b-ed52e7dae896,Simulation Testing,Hoạt động bảo mật nào liên quan đến việc kiểm tra các quy trình khôi phục sau sự cố mà không làm gián đoạn hệ thống sản xuất?,- Category: Security Operations; Topics: Security Operations,* Simulation Testing: Kiểm thử mô phỏng\n- Kiểm thử mô phỏng bao gồm việc kiểm tra các quy trình khôi phục sau sự cố và duy trì hoạt động kinh doanh bằng cách sử dụng các kịch bản mô phỏng mà không làm gián đoạn hệ thống sản xuất. Điều này giúp xác thực khả năng khôi phục và xác định các lỗ hổng một cách có kiểm soát.
d7e3bb2f-5641-4a0f-b6cb-a8352d816f9a,SLE = Asset Value × Exposure Factor,Công thức tính toán tổn thất kỳ vọng đơn lẻ (SLE) là gì?,- Category: Security Principles; Topics: Risk Management,- Mức tổn thất dự kiến ​​đơn lẻ (SLE) được tính bằng Giá trị tài sản (AV) × Hệ số rủi ro (EF). Hệ số rủi ro thể hiện tỷ lệ phần trăm tổn thất có thể xảy ra từ một sự cố đơn lẻ. SLE thể hiện tổn thất tiền tệ dự kiến ​​từ một sự cố đơn lẻ.
cdbd81c2-e7df-41f3-8654-733a2caf908a,Social Engineering,Loại tấn công nào liên quan đến việc lừa người dùng tiết lộ thông tin đăng nhập của họ?,- Category: Access Controls; Topics: Authentication,"* Social Engineering: Tấn công phi kỹ thuật\n- Tấn công phi kỹ thuật (social engineering) liên quan đến việc thao túng người khác để họ tiết lộ thông tin mật hoặc thực hiện các hành động làm tổn hại đến an ninh. Lừa đảo (phishing), giả mạo danh tính (pretexting) và dụ dỗ (baiting) là những kỹ thuật tấn công phi kỹ thuật phổ biến nhắm vào thông tin đăng nhập."
7af20c96-9dd6-44e8-adde-ebd7ca4c75d1,Something you are,Dấu vân tay và quét võng mạc thuộc loại yếu tố xác thực nào?,- Category: Access Controls; Topics: Authentication,"* Something you are: Bạn là một người như thế nào?\n- Các đặc điểm sinh trắc học như dấu vân tay, quét võng mạc và nhận diện khuôn mặt là những yếu tố ""xác định bạn là ai"". Mật khẩu là những gì bạn biết, mã xác thực là những gì bạn sở hữu, và vị trí là nơi bạn đang ở."
951d2fca-d5cd-4672-af28-48d31eefb339,SSH File Transfer Protocol (SFTP),Giao thức nào thường được sử dụng để truyền tải tập tin một cách an toàn qua mạng?,- Category: Network Security; Topics: Network Protocols,"* SSH File Transfer Protocol (SFTP): Giao thức truyền tệp SSH\n- SFTP (Giao thức truyền tệp SSH) cung cấp khả năng truyền tệp an toàn bằng cách mã hóa cả lệnh và dữ liệu. FTP, HTTP và Telnet truyền dữ liệu dưới dạng văn bản thuần và không an toàn cho việc truyền tệp nhạy cảm."
b708ffaf-131c-412c-b456-5cd2c7e090ef,Star topology,Cấu trúc mạng nào kết nối từng thiết bị với bộ định tuyến hoặc bộ chuyển mạch trung tâm?,- Category: Network Security; Topics: Network Security,"* Star Topology: Cấu trúc mạng hình sao\n- Trong cấu trúc mạng hình sao, tất cả các thiết bị đều kết nối với một bộ điều khiển trung tâm hoặc bộ chuyển mạch. Cấu trúc mạng hình bus sử dụng một cáp duy nhất, cấu trúc mạng hình vòng kết nối các thiết bị theo hình tròn, và cấu trúc mạng lưới kết nối các thiết bị với nhiều thiết bị khác."
c7a473f7-feff-4b72-929b-0994ce32bbb4,Subject,Thành phần kiểm soát truy cập nào đại diện cho thực thể yêu cầu truy cập vào tài nguyên?,- Category: Access Controls; Topics: Access Controls,"* Subject: Chủ thể\n- Trong kiểm soát truy cập, chủ thể là thực thể chủ động (người dùng, tiến trình hoặc hệ thống) yêu cầu truy cập vào tài nguyên. Đối tượng là tài nguyên thụ động được truy cập (tệp tin, cơ sở dữ liệu, máy in). Quyền hạn xác định những hành động nào được cho phép."
d34edc63-ac7a-49a0-bba3-ba27318d5abb,Symmetric uses one key; asymmetric uses a key pair (public and private),Sự khác biệt giữa mã hóa đối xứng và mã hóa bất đối xứng là gì?,- Category: Security Operations; Topics: Data Security,* Symmetric uses one key; asymmetric uses a key pair (public and private): Hệ thống đối xứng sử dụng một khóa; hệ thống bất đối xứng sử dụng một cặp khóa (khóa công khai và khóa riêng tư)\n- Mã hóa đối xứng sử dụng một khóa chung duy nhất cho cả mã hóa và giải mã. Mã hóa bất đối xứng sử dụng một cặp khóa: khóa công khai để mã hóa và khóa riêng tư để giải mã. Mã hóa đối xứng nhanh hơn đối với dữ liệu lớn; mã hóa bất đối xứng cho phép trao đổi khóa và chữ ký số.
5a82c775-6f38-4ab5-be1f-735b39f9e665,SYN Flood,Loại tấn công nào liên quan đến việc gửi một lượng lớn gói tin SYN mà không hoàn tất quá trình bắt tay TCP?,- Category: Network Security; Topics: Network Attacks,"- Tấn công SYN flood là một loại tấn công từ chối dịch vụ (DoS) trong đó kẻ tấn công gửi nhiều gói tin SYN nhưng không bao giờ hoàn tất quá trình bắt tay ba bước TCP. Điều này làm cạn kiệt tài nguyên kết nối của mục tiêu, ngăn chặn các kết nối hợp pháp."
eb1ea5c8-d9e8-41f1-8ca3-487092f95ff5,Synchronous Token,Cơ chế xác thực nào sử dụng mật khẩu dùng một lần và thay đổi định kỳ?,- Category: Access Controls; Topics: Authentication,"* Synchronous Token: Token đồng bộ\n- Các token đồng bộ tạo ra mật khẩu dùng một lần, thay đổi định kỳ (thường là 30-60 giây một lần) dựa trên một khóa bí mật được chia sẻ và đồng bộ hóa thời gian. Ví dụ bao gồm RSA SecurID và các ứng dụng xác thực."
6a61467b-c164-4c5a-8a02-789ac10fc787,System Hardening,Quá trình nào bao gồm việc loại bỏ hoặc vô hiệu hóa các dịch vụ và ứng dụng không cần thiết để giảm thiểu bề mặt tấn công?,- Category: Security Operations; Topics: Security Hardening,"* System Hardening: Tăng cường bảo mật hệ thống\n- Tăng cường bảo mật hệ thống là quá trình bảo vệ hệ thống bằng cách giảm thiểu bề mặt tấn công – loại bỏ các dịch vụ không cần thiết, vô hiệu hóa các cổng không sử dụng, áp dụng các bản vá bảo mật và cấu hình các thiết lập bảo mật."
6fa5d199-46a1-4d21-affe-63b3c3c3d244,The assurance that someone cannot deny the validity of an action or transaction,"Trong an ninh thông tin, non-repudiation là gì?",- Category: Security Principles; Topics: CIA Triad,"* The assurance that someone cannot deny the validity of an action or transaction: Đảm bảo rằng không ai có thể phủ nhận tính hợp lệ của một hành động hoặc giao dịch\n- Tính không thể phủ nhận đảm bảo rằng một bên không thể phủ nhận tính xác thực của chữ ký hoặc việc gửi tin nhắn. Điều này thường đạt được thông qua chữ ký điện tử, nhật ký kiểm toán và dấu thời gian cung cấp bằng chứng về nguồn gốc và tính toàn vẹn."
13408f8a-69b5-43bb-bdcb-d92715da1f35,The risk that remains after controls have been implemented,"Trong bối cảnh quản lý rủi ro, rủi ro còn lại là gì?",- Category: Security Principles; Topics: Risk Management,* The risk that remains after controls have been implemented: Rủi ro vẫn còn tồn tại sau khi các biện pháp kiểm soát đã được thực hiện\n- Rủi ro còn lại là rủi ro vẫn tồn tại sau khi các biện pháp kiểm soát an ninh đã được thực hiện. Tổng rủi ro trừ đi rủi ro được giảm thiểu nhờ các biện pháp kiểm soát bằng rủi ro còn lại. Các tổ chức thường hướng đến việc giảm rủi ro còn lại xuống mức chấp nhận được hơn là loại bỏ hoàn toàn rủi ro.
e260acb5-31a4-430f-9156-cd6a47f644c9,They are publicly known and easily exploited by attackers,Mối lo ngại chính về bảo mật khi sử dụng mật khẩu mặc định trên hệ thống là gì?,- Category: Access Controls; Topics: Authentication,* They are publicly known and easily exploited by attackers: Chúng được công khai và dễ bị tin tặc khai thác\n- Mật khẩu mặc định được công khai (thường được ghi trong sách hướng dẫn sử dụng sản phẩm hoặc trên mạng) và dễ bị kẻ tấn công lợi dụng. Thay đổi mật khẩu mặc định trong quá trình cài đặt hệ thống là một biện pháp bảo mật quan trọng để ngăn chặn truy cập trái phép.
72c90923-3f11-41b0-b01f-440bc5617a2f,"To centrally monitor, detect, analyze, and respond to security incidents",Mục đích chính của SOC là gì?,- Category: Security Operations; Topics: Security Operations,"* To centrally monitor, detect, analyze, and respond to security incidents: Để giám sát, phát hiện, phân tích và phản hồi các sự cố an ninh một cách tập trung\n- Trung tâm điều hành an ninh (SOC) là một cơ sở tập trung nơi các chuyên gia an ninh giám sát, phát hiện, phân tích và ứng phó với các sự cố an ninh mạng. Nó thường hoạt động 24/7 để cung cấp khả năng giám sát an ninh liên tục."
f96ab90e-c3f2-433c-b2e2-dd0649cc92f2,"To collect, store, and analyze event data for security monitoring and compliance",Mục đích chính của việc quản lý nhật ký trong hoạt động bảo mật là gì?,- Category: Security Operations; Topics: Security Operations,"* To collect, store, and analyze event data for security monitoring and compliance: Thu thập, lưu trữ và phân tích dữ liệu sự kiện để giám sát an ninh và tuân thủ quy định\n- Quản lý nhật ký bao gồm việc thu thập, lưu trữ và phân tích dữ liệu nhật ký từ nhiều hệ thống và ứng dụng khác nhau. Nó hỗ trợ giám sát an ninh, điều tra sự cố, khắc phục sự cố và đáp ứng các yêu cầu tuân thủ."
