id,answer,question,hint,desc
b7520561-2103-4f67-b44b-b3cd4132d5e6,Aligning IT governance with business objectives,Việc triển khai khung COBIT giúp tổ chức đạt được mục tiêu chính nào?,- CompTIA Security+ (SY0-701),"* Aligning IT governance with business objectives: Đảm bảo quản trị CNTT phù hợp với mục tiêu kinh doanh\n- COBIT (Control Objectives for Information and Related Technologies) là một khung quản trị CNTT giúp các tổ chức điều chỉnh các hoạt động CNTT phù hợp với mục tiêu kinh doanh, quản lý rủi ro liên quan đến CNTT và đảm bảo tuân thủ. Khác với các khung kiểm soát kỹ thuật, COBIT tập trung vào quản trị và quản lý CNTT doanh nghiệp ở cấp chiến lược, thu hẹp khoảng cách giữa yêu cầu kinh doanh và triển khai kỹ thuật."
6b0bb8b4-24bb-4274-bbcf-fe4481bf873a,CIS Controls are prioritized and provide a practical starting point for improving security,Các tiêu chuẩn kiểm soát CIS cung cấp một tập hợp các thực tiễn bảo mật tốt nhất được ưu tiên. Lợi thế CHÍNH của việc triển khai các tiêu chuẩn kiểm soát CIS so với một khuôn khổ toàn diện như NIST 800-53 là gì?,- CompTIA Security+ (SY0-701),"* CIS Controls are prioritized and provide a practical starting point for improving security: Các biện pháp kiểm soát CIS được ưu tiên và cung cấp điểm khởi đầu thiết thực để cải thiện an ninh\n- Các biện pháp kiểm soát CIS được sắp xếp theo mức độ ưu tiên (Nhóm triển khai 1, 2, 3), cung cấp điểm khởi đầu thiết thực và khả thi cho các tổ chức để cải thiện tư thế bảo mật của mình. Không giống như NIST 800-53, cung cấp một danh mục toàn diện các biện pháp kiểm soát, các biện pháp kiểm soát CIS tập trung vào các hành động có tác động lớn nhất trước tiên, điều này làm cho chúng đặc biệt hữu ích cho các tổ chức có nguồn lực bảo mật hạn chế."
01e28ece-f48a-42eb-bb11-9136ae7500c2,FERPA,Một trường đại học lưu trữ hồ sơ học tập và thông tin hỗ trợ tài chính của sinh viên. Quy định nào của Hoa Kỳ bảo vệ quyền riêng tư của hồ sơ giáo dục sinh viên?,- CompTIA Security+ (SY0-701),"- Family Educational Rights and Privacy Act (FERPA): Đạo luật về Quyền Giáo dục và Bảo mật Thông tin Gia đình\n- Đạo luật về Quyền Giáo dục và Bảo mật Thông tin Gia đình (FERPA) bảo vệ quyền riêng tư của hồ sơ giáo dục học sinh và áp dụng cho tất cả các cơ sở giáo dục nhận tài trợ liên bang. FERPA cho phép học sinh (và phụ huynh của trẻ vị thành niên) quyền truy cập hồ sơ của mình, yêu cầu chỉnh sửa và kiểm soát việc tiết lộ thông tin nhận dạng cá nhân từ hồ sơ giáo dục."
3de5f51b-0ec3-4198-ad29-49ffc2343b90,ISO 27001,Một tổ chức muốn đạt được chứng nhận được công nhận toàn cầu cho hệ thống quản lý an ninh thông tin (ISMS) của mình. Họ nên theo đuổi tiêu chuẩn nào?,- CompTIA Security+ (SY0-701),"- ISO 27001 là tiêu chuẩn quốc tế về Hệ thống Quản lý An ninh Thông tin (ISMS), đưa ra các yêu cầu để thiết lập, triển khai, duy trì và liên tục cải tiến một ISMS. Các tổ chức có thể được kiểm toán và chứng nhận theo tiêu chuẩn ISO 27001 bởi các tổ chức chứng nhận được công nhận, biến nó trở thành chứng nhận được công nhận toàn cầu về quản lý an ninh thông tin."
c7e577f3-ab56-4c7f-a12b-ca19d0889ba9,Right to opt-out of sale,"Một công ty có trụ sở tại California thu thập thông tin cá nhân từ cư dân California. Theo CCPA, người tiêu dùng có quyền nào để từ chối việc bán thông tin cá nhân của họ?",- CompTIA Security+ (SY0-701),"* Right to opt-out of sale: Quyền từ chối cung cấp thông tin\n- Đạo luật Bảo vệ Quyền riêng tư Người tiêu dùng California (CCPA) trao cho cư dân California quyền từ chối việc bán thông tin cá nhân của họ. Các doanh nghiệp phải cung cấp một liên kết rõ ràng ""Không bán thông tin cá nhân của tôi"" trên trang web của họ. Quyền này là nền tảng của các biện pháp bảo vệ quyền riêng tư người tiêu dùng theo CCPA và áp dụng cho các doanh nghiệp đáp ứng các ngưỡng doanh thu, khối lượng dữ liệu hoặc doanh thu từ dữ liệu cụ thể."
311638e6-71b2-4652-9321-33e39f676c53,"The operating effectiveness of controls related to security, availability, processing integrity, confidentiality, and/or privacy over a period of time",Một tổ chức trải qua cuộc kiểm toán SOC 2 Loại II hàng năm. Cuộc kiểm toán này đánh giá những gì?,- CompTIA Security+ (SY0-701),"* The operating effectiveness of controls related to security, availability, processing integrity, confidentiality, and/or privacy over a period of time: Hiệu quả hoạt động của các biện pháp kiểm soát liên quan đến bảo mật, tính khả dụng, tính toàn vẹn xử lý, tính bí mật và/hoặc quyền riêng tư trong một khoảng thời gian nhất định. \n- Kiểm toán SOC 2 Loại II đánh giá hiệu quả hoạt động của các biện pháp kiểm soát của tổ chức trong một khoảng thời gian xác định (thường là 6-12 tháng) dựa trên các Tiêu chí Dịch vụ Tin cậy: bảo mật, tính khả dụng, tính toàn vẹn xử lý, tính bí mật và quyền riêng tư. Không giống như Loại I, chỉ đánh giá các biện pháp kiểm soát tại một thời điểm nhất định, Loại II cung cấp sự đảm bảo rằng các biện pháp kiểm soát đang hoạt động hiệu quả một cách nhất quán."
