id,answer,question,hint,desc
140ca92d-44c8-4afc-ab74-e5bd183343ff,Absolute Path Traversal,CWE-36 có tên là gì?,,
a3f1792e-556a-4934-a6ec-1a82bd22aa0f,Active Debug Code,CWE-489 có tên là gì?,,
918fe831-e724-4a92-a39e-7097cfd114f8,ASP.NET Misconfiguration: Creating Debug Binary,CWE-11 có tên là gì?,,
fffd0d26-f513-4cef-8b6f-834d5fe03929,ASP.NET Misconfiguration: Improper Model Validation,CWE-1174 có tên là gì?,,
79afa1df-9ebb-4561-94c7-966d7b018d0a,ASP.NET Misconfiguration: Password in Configuration File,CWE-13 có tên là gì?,,
ff8c47a7-772f-4f59-a8df-71d6f6acb789,Authorization Bypass Through User-Controlled Key,CWE-639 có tên là gì?,,
ad3b5d89-c2bb-4ccb-9390-117b7fbb2b64,Authorization Bypass Through User-Controlled SQL Primary Key,CWE-566 có tên là gì?,,
786d14d3-0e22-4323-b29b-94fcd8c17a78,Cleartext Storage of Sensitive Information in a Cookie,CWE-315 có tên là gì?,,
a6d6d45b-3875-4d68-98dc-8d253df73065,Configuration,CWE-16 có tên là gì?,,
d847ced1-20ae-4406-a8f4-c353b64a54eb,Creation of Temporary File in Directory with Insecure Permissions,CWE-379 có tên là gì?,,
8a9e2a11-232e-47a5-bcae-9b37ee4aba98,Cross-Site Request Forgery (CSRF),CWE-352 có tên là gì?,,
bb392271-8491-4315-b4e5-48c3d76d3d1f,Direct Request ('Forced Browsing'),CWE-425 có tên là gì?,,
64ac0ce6-fe62-4b1f-bcff-8e899d65cb65,Exposed Dangerous Method or Function,CWE-749 có tên là gì?,,
4bd92c44-393a-4eca-b60c-f9e6224f9ce3,Exposure of Information Through Directory Listing,CWE-548 có tên là gì?,,
1e4debe1-79b1-47ef-a024-07ccfe105ea6,Exposure of Private Personal Information to an Unauthorized Actor,CWE-359 có tên là gì?,,
1bf9d620-a3c6-42a7-b6cc-d10893fa295d,Exposure of Resource to Wrong Sphere,CWE-668 có tên là gì?,,
e1fce3b1-553c-4cc6-8a83-6784515fd8d1,Exposure of Sensitive Information Through Environmental Variables,CWE-526 có tên là gì?,,
95d31339-ca98-4b99-b0d7-6f609bdf7a35,Exposure of Sensitive Information Through Sent Data,CWE-201 có tên là gì?,,
de6203fb-7fbf-4181-b2ce-aec2b11d12b1,Exposure of Sensitive Information to an Unauthorized Actor,CWE-200 có tên là gì?,,
421e98a7-3848-4318-8555-95cebf859d46,Exposure of Sensitive System Information to an Unauthorized Control Sphere,CWE-497 có tên là gì?,,
55c1e468-c89f-4f2f-8449-639e4524ae43,External Control of System or Configuration Setting,CWE-15 có tên là gì?,,
8fb6b475-c491-416f-8dd0-ce61bec57ad6,Files or Directories Accessible to External Parties,CWE-552 có tên là gì?,,
680b4a32-1911-43c6-bc48-85d919f365b1,Improper Access Control,CWE-284 có tên là gì?,,
c947acb0-cdf7-48c2-8ce9-e81a5ed638f0,Improper Authorization,CWE-285 có tên là gì?,,
c74556d6-7819-4843-a515-76f8d9aa6aaf,Improper Limitation of a Pathname to a Restricted Directory ('Path Traversal'),CWE-22 có tên là gì?,,
eeb57232-a26d-4b6d-b199-e17ec4a64bcf,Improper Link Resolution Before File Access ('Link Following'),CWE-59 có tên là gì?,,
2e573610-8d71-4411-9927-387d69209f08,Improper Ownership Management,CWE-282 có tên là gì?,,
5aa78e20-6720-47a4-a9bf-4f6d16b7008b,Improper Preservation of Permissions,CWE-281 có tên là gì?,,
fdfb3ce1-49a6-436b-9868-968c16825e40,Improper Protection of Alternate Path,CWE-424 có tên là gì?,,
5fbcba54-9e41-4733-8ada-043bd9e0d9c9,Improper Restriction of Recursive Entity References in DTDs ('XML Entity Expansion'),CWE-776 có tên là gì?,,
7b011ef8-0dfd-4b36-8aec-e5cd3a62b4df,Improper Restriction of XML External Entity Reference,CWE-611 có tên là gì?,,
ae89767d-86aa-4765-8d2d-c304a2b2ef49,Inclusion of Sensitive Information in Source Code,CWE-540 có tên là gì?,,
5a8d5f92-d473-462a-a3aa-4ff243ab1a81,Inclusion of Sensitive Information in Source Code Comments,CWE-615 có tên là gì?,,
d1b7c389-962c-4988-8a2e-859fd52d6fcf,Incorrect Authorization,CWE-863 có tên là gì?,,
760b2ee0-784b-4478-b246-a20b8fccc90d,Incorrect Default Permissions,CWE-276 có tên là gì?,,
002fc633-7cee-4780-a44f-f85edae62782,Incorrect Permission Assignment for Critical Resource,CWE-732 có tên là gì?,,
e36873fc-2eb7-4eb3-b06e-1c797de13ead,Insecure Storage of Sensitive Information,CWE-922 có tên là gì?,,
c06aa503-eff5-42fb-8978-1ac48ac6516f,Insecure Temporary File,CWE-377 có tên là gì?,,
d0d69654-1b64-4f48-8081-defbfb580f37,Insertion of Sensitive Information into Externally-Accessible File or Directory,CWE-538 có tên là gì?,,
ca073433-ac7b-455d-bf84-64989e5bd1e2,J2EE Misconfiguration: Data Transmission Without Encryption,CWE-5 có tên là gì?,,
9251fc1d-332e-4945-885a-848ef5183dab,Missing Authorization,CWE-862 có tên là gì?,,
9a95052a-2492-4739-ac80-868da06337dc,Password in Configuration File,CWE-260 có tên là gì?,,
b3d39467-c9c1-4750-af78-b9dd49b557c7,Permissive Cross-domain Policy with Untrusted Domains,CWE-942 có tên là gì?,,
13372bcd-d57a-42f9-9f57-4feeb2c7d7df,Relative Path Traversal,CWE-23 có tên là gì?,,
b7a32f28-a94d-42f3-8596-338b262e5686,Sensitive Cookie in HTTPS Session Without 'Secure' Attribute,CWE-614 có tên là gì?,,
688f0b46-559a-4076-8e90-57bcab517059,Sensitive Cookie with Improper SameSite Attribute,CWE-1275 có tên là gì?,,
af8b28f6-d95b-491f-bb22-24ecff69b156,Sensitive Cookie Without 'HttpOnly' Flag,CWE-1004 có tên là gì?,,
9e3ae987-8567-45cd-b593-60711789e639,Server-Side Request Forgery (SSRF),CWE-918 có tên là gì?,,
7502f495-e6f0-4154-a91c-47ed9a631a42,Storage of File with Sensitive Data Under Web Root,CWE-219 có tên là gì?,,
e66948cd-800b-4949-a87e-72989bbd1ef6,Transmission of Private Resources into a New Sphere ('Resource Leak'),CWE-402 có tên là gì?,,
d2b3e281-64de-4384-b5a5-69838c312649,Unintended Proxy or Intermediary ('Confused Deputy'),CWE-441 có tên là gì?,,
e78a7f93-b1b6-437c-ac3f-4837b82b72d2,UNIX Symbolic Link (Symlink) Following,CWE-61 có tên là gì?,,
ae1e73e5-eb15-450a-af87-9876cf3afc35,Unverified Ownership,CWE-283 có tên là gì?,,
3f57a149-1aa6-44a2-8b8d-7827d6b8085e,URL Redirection to Untrusted Site ('Open Redirect'),CWE-601 có tên là gì?,,
de7e4457-d11c-44fd-aa15-12b0353ed900,"Use of Hard-coded, Security-relevant Constants",CWE-547 có tên là gì?,,
91888d56-f752-4c62-a768-df58b2e3911a,Windows Hard Link,CWE-65 có tên là gì?,,
