id,answer,question,hint,desc
4aa0cce2-9fc6-415d-a03b-1d079057ae13,Hacktivist,Một nhóm người đã phá hoại trang web của một tập đoàn lớn để phản đối các chính sách môi trường của công ty và đăng tải các thông báo nội bộ của công ty lên mạng. Loại tác nhân đe dọa nào có khả năng NHẤT chịu trách nhiệm cho hành động này?,* Tin tặc vì mục tiêu chính trị,"- Category: Threats Vulnerabilities; Topics: Threat Actors\n\n* Hacktivist: Tin tặc vì mục tiêu chính trị\n- Tin tặc vì mục tiêu chính trị (hacktivist) là những tác nhân đe dọa được thúc đẩy bởi các lý tưởng chính trị, xã hội hoặc tư tưởng. Họ sử dụng các cuộc tấn công mạng để thúc đẩy chương trình nghị sự của mình, thường thông qua việc phá hoại trang web, rò rỉ dữ liệu và tấn công DDoS nhằm vào các tổ chức mà họ phản đối. Mục tiêu của họ là thu hút sự chú ý của công chúng đến lý tưởng của mình chứ không phải lợi ích tài chính, điều này phân biệt họ với các nhóm tội phạm có tổ chức."
87bfb367-e7c6-4200-ba72-6b98f7084383,Identification,"Trong một sự cố an ninh, nhóm ứng phó sự cố (IR) cần xác định phạm vi bị xâm phạm. Họ phát hiện ra rằng kẻ tấn công đã sử dụng phương pháp di chuyển ngang để truy cập vào các hệ thống khác sau khi xâm nhập ban đầu. Hiện tại họ đang ở giai đoạn ứng phó sự cố nào?",* Nhận diện,"- Category: Security Operations; Topics: Incident Response\n\n* Identification: Nhận diện\n- Giai đoạn nhận dạng bao gồm việc phát hiện và xác định phạm vi của sự cố. Khi nhóm ứng phó sự cố (IR) đang điều tra xem hệ thống nào bị xâm phạm và kẻ tấn công đã di chuyển ngang qua mạng như thế nào, họ vẫn đang trong giai đoạn nhận dạng. Hiểu rõ toàn bộ phạm vi là điều cần thiết trước khi có thể triển khai các chiến lược ngăn chặn hiệu quả."
bc28ed37-8521-4f91-ab17-6bf4ed0171bb,Implement a centralized key management system (KMS) with customer-managed keys across all providers,"Một tổ chức lưu trữ dữ liệu nhạy cảm trên nhiều nhà cung cấp dịch vụ đám mây khác nhau. Để đảm bảo mã hóa và quản lý khóa nhất quán trên tất cả các môi trường, họ nên áp dụng phương pháp nào?",* Triển khai hệ thống quản lý khóa tập trung (KMS) với các khóa do khách hàng tự quản lý trên tất cả các nhà cung cấp,"- Category: Security Architecture; Topics: Cloud Security\n\n* Implement a centralized key management system (KMS) with customer-managed keys across all providers: Triển khai hệ thống quản lý khóa tập trung (KMS) với các khóa do khách hàng tự quản lý trên tất cả các nhà cung cấp\n- Hệ thống quản lý khóa tập trung với các khóa do khách hàng quản lý cung cấp khả năng quản lý mã hóa nhất quán trên nhiều môi trường đám mây. Các khóa do khách hàng quản lý đảm bảo tổ chức duy trì quyền kiểm soát các khóa mã hóa bất kể nhà cung cấp dịch vụ đám mây nào, cho phép thiết lập các chính sách nhất quán, xoay vòng khóa và kiểm soát truy cập. Cách tiếp cận này ngăn ngừa tình trạng phụ thuộc vào nhà cung cấp duy nhất về mã hóa và đảm bảo tổ chức có thể thu hồi quyền truy cập dữ liệu nếu cần."
c0b0863f-3ad0-42a8-90bf-5006c4f9f986,Implement redundant internet connections from different ISPs,Đánh giá rủi ro cho thấy rủi ro lớn nhất của tổ chức là điểm yếu duy nhất trong kết nối internet. Điểm rủi ro trên bản đồ nhiệt nằm trong vùng đỏ. Ban quản lý yêu cầu một kế hoạch giảm thiểu rủi ro. Hành động nào sẽ giảm thiểu rủi ro này một cách TỐT NHẤT?,* Triển khai các kết nối internet dự phòng từ các nhà cung cấp dịch vụ internet khác nhau,"- Category: Program Management; Topics: Risk Management\n\n* Implement redundant internet connections from different ISPs: Triển khai các kết nối internet dự phòng từ các nhà cung cấp dịch vụ internet khác nhau\n- Giảm thiểu rủi ro làm giảm khả năng xảy ra hoặc tác động của rủi ro thông qua việc triển khai các biện pháp kiểm soát. Việc bổ sung các kết nối internet dự phòng từ các nhà cung cấp dịch vụ internet khác nhau sẽ loại bỏ điểm lỗi duy nhất và giảm đáng kể khả năng xảy ra sự cố mất kết nối internet hoàn toàn. Điều này trực tiếp giải quyết rủi ro đã được xác định trong khi vẫn duy trì hoạt động kinh doanh, không giống như việc né tránh (ngắt kết nối) hoặc chuyển giao (bảo hiểm)."
a3eb00bf-a447-4287-be1e-7cd606110280,Incident response plan,"Trong một tình huống giả định trong bài tập mô phỏng, một người tham gia hỏi ai có thẩm quyền quyết định có nên tắt máy chủ sản xuất trong một cuộc tấn công đang diễn ra hay không. Thẩm quyền quyết định này nên được định nghĩa trong tài liệu nào?",* Kế hoạch ứng phó sự cố,"- Category: Security Operations; Topics: Incident Response\n\n* Incident response plan: Kế hoạch ứng phó sự cố\n- Kế hoạch ứng phó sự cố cần xác định rõ ràng vai trò, trách nhiệm và quyền ra quyết định cho các tình huống sự cố khác nhau, bao gồm cả người có thể cho phép tắt hệ thống sản xuất. Điều này đảm bảo rằng các quyết định quan trọng có thể được đưa ra nhanh chóng trong quá trình xảy ra sự cố mà không gây nhầm lẫn về quyền hạn, điều này đặc biệt quan trọng khi hoạt động kinh doanh có thể bị ảnh hưởng."
9817e3a9-5004-4086-9cf5-6ddf49e3bf1b,Insider threat,Một quản trị viên hệ thống bất mãn vì vừa bị bỏ qua trong đợt thăng chức đã cài đặt một quả bom logic vào máy chủ của công ty trước khi từ chức. Hành động này thể hiện loại tác nhân đe dọa nào?,* Mối đe dọa nội bộ,"- Category: Threats Vulnerabilities; Topics: Threat Actors\n\n* Insider threat: Mối đe dọa nội bộ\n- Mối đe dọa nội bộ là rủi ro bảo mật phát sinh từ bên trong tổ chức, thường là từ các nhân viên hiện tại hoặc trước đây, nhà thầu hoặc đối tác kinh doanh có quyền truy cập được ủy quyền vào hệ thống. Quản trị viên bất mãn này là một ví dụ điển hình về mối đe dọa nội bộ — họ lợi dụng quyền truy cập hợp pháp và kiến ​​thức về hệ thống nội bộ để cài đặt mã độc hại do mâu thuẫn cá nhân."
568aa0ca-d374-4d71-bb47-cee9bd1ca3d4,Integrity,Một tổ chức tài chính triển khai mã kiểm tra và chữ ký số trên tất cả các lệnh chuyển khoản điện tử. Yếu tố nào trong bộ ba CIA đang được giải quyết chủ yếu?,* Toàn vẹn,"- Category: General Concepts; Topics: CIA Triad\n\n* Integrity: Toàn vẹn\n- Mã kiểm tra và chữ ký số chủ yếu bảo vệ tính toàn vẹn bằng cách đảm bảo dữ liệu không bị thay đổi trong quá trình truyền tải hoặc lưu trữ. Nếu lệnh chuyển khoản bị sửa đổi sau khi đã được ký, quá trình xác minh mã kiểm tra hoặc chữ ký sẽ thất bại, báo hiệu cho người nhận rằng tin nhắn đã bị giả mạo."
29663894-8212-4a39-8e9f-80a03d90c749,Integrity,"Quản trị viên cơ sở dữ liệu triển khai ghi nhật ký trước khi ghi (WAL) để đảm bảo rằng nếu hệ thống gặp sự cố trong quá trình giao dịch, cơ sở dữ liệu có thể được khôi phục về trạng thái nhất quán. Điều này chủ yếu hỗ trợ yếu tố nào trong bộ ba CIA?",* Toàn vẹn,"- Category: General Concepts; Topics: CIA Triad\n\n* Integrity: Toàn vẹn\n- Ghi nhật ký trước (Write-ahead logging - WAL) chủ yếu hỗ trợ tính toàn vẹn bằng cách đảm bảo các giao dịch cơ sở dữ liệu được hoàn tất đầy đủ hoặc được hoàn tác hoàn toàn, duy trì tính nhất quán dữ liệu ngay cả sau sự cố. WAL ghi lại tất cả các thay đổi trước khi chúng được áp dụng vào cơ sở dữ liệu, cho phép khôi phục về trạng thái nhất quán và ngăn chặn việc ghi một phần có thể làm hỏng dữ liệu."
62e29c62-f280-4c57-8fff-e86b1756ca58,"It enables content filtering, logging, and caching of outbound web requests",Một tổ chức sử dụng máy chủ proxy chuyển tiếp cho tất cả lưu lượng truy cập internet đi ra từ các máy trạm của nhân viên. Lợi ích bảo mật nào sau đây là của cấu hình này?,"* Nó cho phép lọc nội dung, ghi nhật ký và lưu vào bộ nhớ đệm các yêu cầu web gửi đi","- Category: Security Architecture; Topics: Network Architecture\n\n* It enables content filtering, logging, and caching of outbound web requests: Nó cho phép lọc nội dung, ghi nhật ký và lưu vào bộ nhớ đệm các yêu cầu web gửi đi\n- Máy chủ proxy chuyển tiếp đóng vai trò trung gian giữa các máy khách nội bộ và máy chủ bên ngoài. Lợi ích về bảo mật bao gồm lọc nội dung (chặn truy cập vào các trang web độc hại hoặc bị cấm), ghi nhật ký toàn bộ lưu lượng truy cập web cho mục đích kiểm toán và điều tra, lưu trữ nội dung được truy cập thường xuyên để giảm băng thông và thực thi các chính sách sử dụng hợp lý. Proxy cũng có thể che giấu địa chỉ IP nội bộ khỏi các máy chủ bên ngoài."
c848d760-79fc-450d-b10a-1c3c971c120e,Least privilege,Một công ty triển khai kiểm soát truy cập dựa trên vai trò (RBAC) cho hệ thống ERP của mình. Một nhân viên mới trong bộ phận kế toán được tự động cấp quyền truy cập vào báo cáo tài chính nhưng không thể truy cập vào hồ sơ nhân sự. RBAC thực thi nguyên tắc bảo mật nào?,* Đặc quyền tối thiểu,- Category: General Concepts; Topics: Authentication Authorization\n\n* Least privilege: Đặc quyền tối thiểu\n- RBAC thực thi nguyên tắc quyền hạn tối thiểu bằng cách chỉ cấp cho người dùng các quyền cần thiết cho vai trò công việc cụ thể của họ. Nhân viên kế toán được cấp quyền truy cập vào báo cáo tài chính (cần thiết cho vai trò của họ) nhưng không được cấp quyền truy cập vào hồ sơ nhân sự (không cần thiết). Nguyên tắc quyền hạn tối thiểu giảm thiểu thiệt hại tiềm tàng từ việc tài khoản bị xâm phạm bằng cách giới hạn quyền truy cập chỉ ở mức cần thiết.
dfe3fa2d-1fdd-4187-a797-883fefe1bbcf,Living Off the Land (LOtL),"Trong một cuộc diễn tập săn lùng mối đe dọa, một nhà phân tích phát hiện ra rằng một tiến trình Windows hợp pháp (svchost.exe) đang liên lạc với một địa chỉ IP bên ngoài trên một cổng bất thường. Đây là một ví dụ về kỹ thuật tấn công nào?",* Sống dựa vào hệ thống,"- Category: Security Operations; Topics: Monitoring Alerting\n\n* Living Off the Land (LOtL): Sống dựa vào hệ thống\n- Kỹ thuật ""sống dựa vào hệ thống"" (LOtL) liên quan đến việc kẻ tấn công sử dụng các công cụ và quy trình hệ thống hợp pháp, được cài đặt sẵn để thực hiện các hoạt động độc hại. Bằng cách sử dụng các quy trình đáng tin cậy như svchost.exe để liên lạc điều khiển và ra lệnh, kẻ tấn công có thể hòa nhập vào hoạt động bình thường của hệ thống và né tránh các phương pháp phát hiện dựa trên chữ ký truyền thống."
b85ee569-30ad-45f6-a8a5-83aa917d1631,Maintaining a software bill of materials (SBOM) and monitoring for vulnerabilities in dependencies,"Một vụ tấn công chuỗi cung ứng phần mềm gần đây đã làm tổn hại đến một thư viện mã nguồn mở được sử dụng rộng rãi, ảnh hưởng đến hàng nghìn tổ chức. Biện pháp quản lý rủi ro nào sẽ giúp tổ chức giảm thiểu loại mối đe dọa này một cách TỐT NHẤT?",* Duy trì danh sách các thành phần phần mềm (SBOM) và giám sát các lỗ hổng trong các thành phần phụ thuộc,"- Category: Program Management; Topics: Security Awareness\n\n* Maintaining a software bill of materials (SBOM) and monitoring for vulnerabilities in dependencies: Duy trì danh sách các thành phần phần mềm (SBOM) và giám sát các lỗ hổng trong các thành phần phụ thuộc\n- Danh mục linh kiện phần mềm (SBOM) cung cấp một bản kiểm kê toàn diện tất cả các thành phần và phụ thuộc phần mềm được sử dụng trong các ứng dụng của một tổ chức. Bằng cách duy trì SBOM và liên tục giám sát nó để phát hiện các lỗ hổng đã biết, các tổ chức có thể nhanh chóng xác định khi nào một thư viện bị xâm phạm xuất hiện trong môi trường của họ và thực hiện các biện pháp khắc phục, giảm đáng kể nguy cơ bị tấn công chuỗi cung ứng."
6c58f4f9-8fb8-4c92-a538-3a872cbcb418,Matching cryptographic hashes from collection through analysis with documented chain of custody,Một chuyên gia pháp y cần trình bày bằng chứng kỹ thuật số trước tòa. Luật sư đối phương nghi ngờ tính toàn vẹn của bằng chứng. Phương án nào sau đây sẽ chứng minh TỐT NHẤT rằng bằng chứng không bị thay đổi?,* Đối chiếu các mã băm mật mã từ khâu thu thập đến phân tích với chuỗi bằng chứng được ghi chép đầy đủ,"- Category: Security Operations; Topics: Digital Forensics\n\n* Matching cryptographic hashes from collection through analysis with documented chain of custody: Đối chiếu các mã băm mật mã từ khâu thu thập đến phân tích với chuỗi bằng chứng được ghi chép đầy đủ\n- Việc đối chiếu các mã băm mật mã (như SHA-256) được tính toán tại thời điểm thu thập và được xác minh ở mỗi bước tiếp theo, kết hợp với chuỗi chứng cứ được ghi chép đầy đủ, cung cấp bằng chứng toán học cho thấy chứng cứ không bị thay đổi. Sự kết hợp giữa xác minh kỹ thuật và tài liệu quy trình này là tiêu chuẩn vàng để chứng minh tính toàn vẹn của chứng cứ trong các thủ tục pháp lý."
8788efe6-491a-4107-acdc-42807110891a,Misconfiguration,"Trong quá trình đánh giá lỗ hổng bảo mật, máy quét phát hiện một ứng dụng web chạy trên Apache đã bật tính năng liệt kê thư mục, làm lộ cấu trúc tệp nội bộ cho bất kỳ ai truy cập URL đó. Lỗ hổng này thuộc loại nào?",* Cấu hình sai,"- Category: Threats Vulnerabilities; Topics: Vulnerability Types\n\n* Misconfiguration: Cấu hình sai\n- Việc cho phép hiển thị danh sách thư mục là một lỗ hổng cấu hình sai — phần mềm hoạt động đúng như thiết kế, nhưng cấu hình của nó không tuân theo các thực tiễn bảo mật tốt nhất. Hiển thị danh sách thư mục làm lộ cấu trúc tệp của máy chủ web cho bất kỳ ai, có khả năng tiết lộ các tệp nhạy cảm, tệp sao lưu hoặc quy ước đặt tên nội bộ. Việc tăng cường bảo mật máy chủ đúng cách bao gồm vô hiệu hóa hiển thị danh sách thư mục, xóa các trang mặc định và hạn chế các tính năng không cần thiết."
cf2cf3fc-0d82-40f1-a3ab-60a3c0d7131e,Nation-state actor,Một nhóm tin tặc được đầu tư mạnh đã nhắm mục tiêu vào tài sản trí tuệ của một nhà thầu quốc phòng bằng cách sử dụng các mối đe dọa dai dẳng nâng cao (APT) trong nhiều tháng. Cuộc tấn công cho thấy kỹ thuật tinh vi và được cho là do một chính phủ nước ngoài tài trợ. Đây là loại tác nhân đe dọa nào?,* Tác nhân quốc gia,"- Category: Threats Vulnerabilities; Topics: Threat Actors\n\n* Nation-state actor: Tác nhân quốc gia\n- Các tác nhân nhà nước là những nhóm đe dọa được chính phủ tài trợ, sở hữu nguồn lực đáng kể, khả năng tiên tiến và mục tiêu chiến lược dài hạn. Chúng thường nhắm mục tiêu vào quốc phòng, tình báo và cơ sở hạ tầng trọng yếu bằng cách sử dụng các cuộc tấn công có chủ đích (APT). Các cuộc tấn công của chúng được đặc trưng bởi các kỹ thuật tinh vi, sự dai dẳng trong nhiều tháng hoặc nhiều năm, và sự hậu thuẫn của bộ máy tình báo quốc gia."
53d0e909-f058-4b1a-88dc-d57b3354a743,"Obtain proper legal authorization (e.g., corporate policy consent, warrant, or legal hold)",Một nhóm điều tra pháp y đang điều tra một mối đe dọa nội bộ tiềm tàng. Họ cần phân tích máy tính xách tay của công ty nghi phạm nhưng phải đảm bảo hành động của mình hợp pháp. Bước nào là QUAN TRỌNG NHẤT trước khi bắt đầu quá trình kiểm tra?,"* Phải có sự cho phép hợp pháp thích hợp (ví dụ: sự chấp thuận theo chính sách của công ty, lệnh khám xét hoặc lệnh tạm giữ hợp pháp)","- Category: Security Operations; Topics: Digital Forensic\n\n* Obtain proper legal authorization (e.g., corporate policy consent, warrant, or legal hold): Phải có sự cho phép hợp pháp thích hợp (ví dụ: sự chấp thuận theo chính sách của công ty, lệnh khám xét hoặc lệnh tạm giữ hợp pháp)\n- Trước khi kiểm tra bất kỳ thiết bị nào, nhóm pháp y phải có được sự cho phép hợp pháp. Sự cho phép này có thể dựa trên các chính sách sử dụng được chấp nhận của công ty, cho phép tổ chức kiểm tra thiết bị thuộc sở hữu của công ty, lệnh tạm giữ hợp pháp hoặc lệnh của tòa án. Nếu không có sự cho phép hợp lệ, bất kỳ bằng chứng nào được thu thập đều có thể không được chấp nhận và có thể khiến tổ chức phải chịu trách nhiệm pháp lý."
e96764cb-b995-478e-8ab7-97fe0703e2cb,On-path (man-in-the-middle) attack,"Kẻ tấn công tự đặt mình giữa máy khách và máy chủ trên mạng Wi-Fi công cộng, chặn bắt và có khả năng sửa đổi thông tin liên lạc trong thời gian thực. Đây là loại tấn công nào?",* Tấn công trên đường truyền,"- Category: Threats Vulnerabilities; Topics: Attack Types\n\n* On-path (man-in-the-middle) attack: Tấn công trên đường truyền\n- Tấn công trên đường truyền (trước đây gọi là tấn công người trung gian hoặc MITM) xảy ra khi kẻ tấn công bí mật chặn và có thể thay đổi thông tin liên lạc giữa hai bên tin rằng họ đang liên lạc trực tiếp. Trên mạng Wi-Fi công cộng, kẻ tấn công có thể sử dụng các công cụ như giả mạo ARP để chuyển hướng lưu lượng truy cập qua thiết bị của chúng. Mã hóa TLS/SSL và xác minh chứng chỉ là những biện pháp phòng vệ chính chống lại các cuộc tấn công trên đường truyền."
d11ef628-bd01-46bd-a445-40c91fcd6e03,Online Certificate Status Protocol (OCSP),Một quản trị viên bảo mật phát hiện ra rằng một chứng chỉ đã bị xâm phạm và cần phải bị vô hiệu hóa trước ngày hết hạn. Cơ chế nào cho phép kiểm tra trạng thái thu hồi chứng chỉ theo thời gian thực?,* Giao thức trạng thái chứng chỉ trực tuyến,"- Category: Security Architecture; Topics: PKI\n\n* Online Certificate Status Protocol (OCSP): Giao thức trạng thái chứng chỉ trực tuyến\n- Giao thức OCSP (Online Certificate Status Protocol) cung cấp khả năng kiểm tra thu hồi chứng chỉ theo thời gian thực bằng cách cho phép máy khách truy vấn bộ phản hồi OCSP về trạng thái của một chứng chỉ cụ thể. Không giống như CRL (là các danh sách được công bố định kỳ cần phải tải xuống và phân tích), OCSP cung cấp phản hồi tức thì, cập nhật cho từng chứng chỉ. Kỹ thuật OCSP stapling cải thiện hiệu suất bằng cách cho phép máy chủ lưu vào bộ nhớ đệm và hiển thị phản hồi OCSP trong quá trình bắt tay TLS."
1b6f9f48-47ee-4220-8914-bd679f352cbd,Operating system patching and access control configuration,"Trong mô hình trách nhiệm chung đối với việc triển khai điện toán đám mây IaaS, trách nhiệm nào sau đây thuộc về KHÁCH HÀNG?",* Vá lỗi hệ điều hành và cấu hình kiểm soát truy cập,"- Category: Security Architecture; Topics: Cloud Security\n\n* Operating system patching and access control configuration: Vá lỗi hệ điều hành và cấu hình kiểm soát truy cập\n- Trong mô hình chia sẻ trách nhiệm IaaS, khách hàng chịu trách nhiệm cho mọi thứ ở trên cấp độ hypervisor: vá lỗi hệ điều hành, bảo mật ứng dụng, mã hóa dữ liệu, quản lý danh tính và quyền truy cập, và cấu hình tường lửa. Nhà cung cấp dịch vụ đám mây chịu trách nhiệm về cơ sở hạ tầng vật lý, phần cứng mạng, hypervisor và bảo mật trung tâm dữ liệu. Hiểu rõ sự phân chia này là rất quan trọng để duy trì bảo mật trong môi trường đám mây."
f7b787ad-84e3-4e2f-a033-1b3061d0790b,Organized crime,"Một nhóm tội phạm mạng vận hành nền tảng ransomware-as-a-service (RaaS), tuyển dụng các thành viên để triển khai ransomware và chia lợi nhuận. Loại phân loại tác nhân đe dọa nào mô tả chính xác nhất nhóm này?",* Tội phạm có tổ chức,"- Category: Threats Vulnerabilities; Topics: Threat Actors\n\n* Organized crime: Tội phạm có tổ chức\n- Các nhóm tội phạm có tổ chức trong không gian mạng chủ yếu bị thúc đẩy bởi lợi ích tài chính và vận hành các hoạt động tội phạm tinh vi. Việc vận hành nền tảng RaaS (Remote Access as a Service) thể hiện những đặc điểm nổi bật của tội phạm có tổ chức: hoạt động có cấu trúc, mô hình chia sẻ lợi nhuận, tuyển mộ thành viên và coi tội phạm mạng như một hoạt động kinh doanh. Các nhóm này thường có nguồn lực đáng kể và hoạt động xuyên biên giới quốc tế."
2cc517fe-7c45-406b-9802-4d0b415baa54,Phishing,"Một nhân viên nhận được một email có vẻ như đến từ bộ phận CNTT, yêu cầu họ nhấp vào một liên kết để đặt lại mật khẩu. Liên kết này dẫn đến một trang đăng nhập giả mạo nhằm thu thập thông tin đăng nhập. Đây là loại tấn công kỹ thuật xã hội nào?",* Tấn công lừa đảo,- Category: Threats Vulnerabilities; Topics: Social Engineering\n\n* Phishing: Tấn công lừa đảo\n- Tấn công lừa đảo (phishing) là một hình thức tấn công kỹ thuật xã hội sử dụng email giả mạo để lừa người nhận tiết lộ thông tin nhạy cảm hoặc nhấp vào các liên kết độc hại. Email này giả mạo một tổ chức đáng tin cậy (bộ phận CNTT) và tạo ra sự khẩn cấp (yêu cầu đặt lại mật khẩu) để thao túng nạn nhân. Tấn công lừa đảo vẫn là một trong những phương thức tấn công ban đầu phổ biến và hiệu quả nhất được các đối tượng tấn công sử dụng.
