id,answer,question,hint,desc
9e162c71-081d-4694-a5e6-8c3a08dff7f3,Differential backups capture changes since the last full backup; incremental backups capture changes since the last backup of any type,Sự khác biệt chính giữa sao lưu vi sai và sao lưu gia tăng là gì?,- CompTIA Security+ (SY0-701),"* Differential backups capture changes since the last full backup; incremental backups capture changes since the last backup of any type: Sao lưu khác biệt (vi sai) ghi lại những thay đổi kể từ lần sao lưu đầy đủ gần nhất; sao lưu gia tăng ghi lại những thay đổi kể từ lần sao lưu bất kỳ loại nào gần nhất\n- Sao lưu khác biệt (differential backup) ghi lại tất cả các thay đổi kể từ lần sao lưu đầy đủ gần nhất, kích thước tệp sao lưu sẽ tăng lên mỗi ngày. Sao lưu gia tăng (incremental backup) chỉ ghi lại các thay đổi kể từ lần sao lưu gần nhất thuộc bất kỳ loại nào (đầy đủ hoặc gia tăng), dẫn đến các tệp sao lưu riêng lẻ nhỏ hơn. Sao lưu khác biệt tạo chậm hơn nhưng khôi phục nhanh hơn (chỉ cần bản sao lưu đầy đủ + bản sao lưu khác biệt mới nhất), trong khi sao lưu gia tăng tạo nhanh hơn nhưng có thể khôi phục chậm hơn (cần bản sao lưu đầy đủ + tất cả các bản sao lưu gia tăng)."
59dacc8d-2a99-4c88-962f-df5f9e02d1ee,"Documenting what worked, what failed, and recommendations for improvement","Sau một vụ vi phạm an ninh nghiêm trọng, nhóm ứng phó sự cố (IR) tiến hành cuộc họp rút kinh nghiệm. Kết quả quan trọng NHẤT của cuộc họp này là gì?",- CompTIA Security+ (SY0-701),"* Documenting what worked, what failed, and recommendations for improvement: Ghi chép lại những gì đã hiệu quả, những gì đã thất bại và các đề xuất để cải thiện\n- Cuộc họp rút kinh nghiệm (hoặc sau sự cố) nên tập trung vào việc ghi lại những gì đã hoạt động tốt, những gì đã thất bại và các khuyến nghị khả thi để cải thiện quy trình ứng phó sự cố. Cách tiếp cận không đổ lỗi này khuyến khích việc báo cáo trung thực và dẫn đến những cải tiến cụ thể đối với các chính sách, thủ tục và biện pháp kiểm soát kỹ thuật, từ đó củng cố tư thế an ninh tổng thể của tổ chức."
afd5d166-0012-4669-8a13-a31ee19a0c9a,Eradication,"Sau khi khống chế được sự bùng phát của phần mềm độc hại, nhóm ứng phó sự cố cần loại bỏ mọi dấu vết của phần mềm độc hại khỏi các hệ thống bị ảnh hưởng. Điều này mô tả giai đoạn ứng phó sự cố nào?",- CompTIA Security+ (SY0-701),"* Eradication: Diệt trừ\n- Diệt trừ là giai đoạn loại bỏ nguyên nhân gốc rễ của sự cố khỏi môi trường. Điều này bao gồm việc gỡ bỏ phần mềm độc hại, vá các lỗ hổng bị khai thác, vô hiệu hóa các tài khoản bị xâm phạm và đảm bảo tất cả các điểm xâm nhập của kẻ tấn công đã bị loại bỏ. Diệt trừ triệt để là điều cần thiết trước khi chuyển sang giai đoạn phục hồi để ngăn ngừa tái nhiễm."
a9e21c59-8402-4035-a191-66c7a78eb3fe,Incident response plan,"Trong một tình huống giả định trong bài tập mô phỏng, một người tham gia hỏi ai có thẩm quyền quyết định có nên tắt máy chủ sản xuất trong một cuộc tấn công đang diễn ra hay không. Thẩm quyền quyết định này nên được định nghĩa trong tài liệu nào?",- CompTIA Security+ (SY0-701),"* Incident response plan: Kế hoạch ứng phó sự cố\n- Kế hoạch ứng phó sự cố cần xác định rõ ràng vai trò, trách nhiệm và quyền ra quyết định cho các tình huống sự cố khác nhau, bao gồm cả người có thể cho phép tắt hệ thống sản xuất. Điều này đảm bảo rằng các quyết định quan trọng có thể được đưa ra nhanh chóng trong quá trình xảy ra sự cố mà không gây nhầm lẫn về quyền hạn, điều này đặc biệt quan trọng khi hoạt động kinh doanh có thể bị ảnh hưởng."
974d2297-e96b-4c03-ac21-642de4dc43d7,Regular backup testing and verification,Một tổ chức đang thử nghiệm quy trình khôi phục bản sao lưu và phát hiện ra rằng bản sao lưu cơ sở dữ liệu quan trọng bị hỏng và không thể khôi phục. Phát hiện này làm nổi bật tầm quan trọng của thực tiễn nào?,- CompTIA Security+ (SY0-701),"* Regular backup testing and verification: Kiểm tra và xác minh sao lưu định kỳ\n- Việc kiểm tra và xác minh bản sao lưu thường xuyên đảm bảo rằng các bản sao lưu có thể sử dụng được khi cần. Nếu không có các bài kiểm tra khôi phục định kỳ, các tổ chức có thể chỉ phát hiện ra rằng các bản sao lưu của họ bị hỏng, không đầy đủ hoặc không tương thích khi xảy ra thảm họa thực sự, lúc đó đã quá muộn. Thực tiễn tốt nhất yêu cầu các bài kiểm tra khôi phục theo lịch trình để xác thực tính toàn vẹn của bản sao lưu và quy trình khôi phục."
9eb589b5-86af-4508-8106-05046cd00beb,The incident response team lead and legal counsel,"Kế hoạch ứng phó sự cố (IR) của một tổ chức quy định các kênh liên lạc khác nhau cho các mức độ nghiêm trọng khác nhau của sự cố. Đối với một sự cố nghiêm trọng ảnh hưởng đến dữ liệu khách hàng, theo các thực tiễn tốt nhất, ai nên được thông báo ĐẦU TIÊN?",- CompTIA Security+ (SY0-701),"* The incident response team lead and legal counsel: Trưởng nhóm ứng phó sự cố và cố vấn pháp lý\n- Đối với sự cố nghiêm trọng liên quan đến dữ liệu khách hàng, trưởng nhóm ứng phó sự cố (IR) và cố vấn pháp lý cần được thông báo trước tiên. Trưởng nhóm IR điều phối phản ứng kỹ thuật, trong khi cố vấn pháp lý tư vấn về các yêu cầu thông báo theo quy định (như GDPR, HIPAA hoặc luật thông báo vi phạm của tiểu bang), các vấn đề về trách nhiệm pháp lý và chiến lược truyền thông. Việc công khai thông tin quá sớm có thể làm phức tạp quá trình điều tra và phản ứng pháp lý."
5ddaa938-ca4e-491a-ba05-e9ee668a7506,To walk through incident scenarios and validate the IR plan without live system testing,Một công ty tiến hành diễn tập tình huống giả định hàng năm cho đội ứng phó sự cố của mình. Mục đích CHÍNH của cuộc diễn tập này là gì?,- CompTIA Security+ (SY0-701),"* To walk through incident scenarios and validate the IR plan without live system testing: Thực hiện các bước xử lý sự cố và xác thực kế hoạch ứng phó sự cố mà không cần kiểm thử hệ thống thực tế. \n- Diễn tập trên bàn là một phiên thảo luận, trong đó nhóm ứng phó sự cố cùng nhau xem xét các kịch bản sự cố mô phỏng để xác thực kế hoạch ứng phó, xác định những thiếu sót và làm rõ vai trò, trách nhiệm. Khác với các cuộc diễn tập thực tế hoặc kiểm thử xâm nhập, diễn tập trên bàn không liên quan đến việc kiểm thử hệ thống thực tế, do đó đây là một cách thức chi phí thấp, rủi ro thấp để nâng cao khả năng chuẩn bị ứng phó sự cố."
