id,answer,question,desc,ref
4030bbb1-499e-4aa9-a334-99b3d7b18ad7,"-- ends options, ensures file is read. {BRIGHT_CYAN}(Dấu -- kết thúc tùy chọn, đảm bảo file được đọc đúng.)",What does {BRIGHT_GREEN}cat -- access.log{RESET} do? {BRIGHT_CYAN}(Lệnh cat -- access.log dùng để làm gì?),,
cedff9ea-557f-4403-b524-32006ce0ecf1,"Backslash escapes newline, still prints file. {BRIGHT_CYAN}(Dấu \ thoát xuống dòng, vẫn in file.)",What does {BRIGHT_GREEN}cat access.log{RESET} do? {BRIGHT_CYAN}(Lệnh cat access.log\ dùng để làm gì?),,
25e4d3b0-479a-43dd-aca0-79500855706d,"Command substitution, prints file contents. {BRIGHT_CYAN}(Dùng command substitution để in nội dung file.)","What does {BRIGHT_GREEN}echo ""$(<access.log)""{RESET} do? {BRIGHT_CYAN}(Lệnh echo ""$(<access.log)"" dùng để làm gì?)",,
9e401cae-91d2-416a-857e-aa7ffc1d5de6,Concatenates all .log files. {BRIGHT_CYAN}(Ghép và in tất cả file có đuôi .log.),What does {BRIGHT_GREEN}cat *.log{RESET} do? {BRIGHT_CYAN}(Lệnh cat *.log dùng để làm gì?),,
256e544d-f75e-4404-a85c-719193d6e2db,Concatenates all files ending with log. {BRIGHT_CYAN}(Ghép và in tất cả file kết thúc bằng log.),What does {BRIGHT_GREEN}cat *log{RESET} do? {BRIGHT_CYAN}(Lệnh cat *log dùng để làm gì?),,
1e8690ec-e3d2-429a-ba71-5bc91e6a391b,Concatenates all files matching access.log*. {BRIGHT_CYAN}(Ghép và in các file khớp với access.log*.),What does {BRIGHT_GREEN}cat access.log*{RESET} do? {BRIGHT_CYAN}(Lệnh cat access.log* dùng để làm gì?),,
be008260-0fa5-4981-a3ab-f3eba0fdbb9a,Concatenates all files starting with a. {BRIGHT_CYAN}(Ghép và in tất cả file bắt đầu bằng chữ a.),What does {BRIGHT_GREEN}cat a*{RESET} do? {BRIGHT_CYAN}(Lệnh cat a* dùng để làm gì?),,
9170c61c-7a1a-4bc1-9609-ee13a252dffe,Concatenates all files starting with acc. {BRIGHT_CYAN}(Ghép và in các file bắt đầu bằng acc.),What does {BRIGHT_GREEN}cat acc*{RESET} do? {BRIGHT_CYAN}(Lệnh cat acc* dùng để làm gì?),,
7c1c30e6-ee79-4906-bd69-75ccb460328d,Concatenates all files starting with access. {BRIGHT_CYAN}(Ghép và in các file bắt đầu bằng access.),What does {BRIGHT_GREEN}cat access*{RESET} do? {BRIGHT_CYAN}(Lệnh cat access* dùng để làm gì?),,
de9efa6f-ac0a-4b7d-8486-93ffc5a07836,Concatenates all files starting with access.. {BRIGHT_CYAN}(Ghép và in các file bắt đầu bằng access..),What does {BRIGHT_GREEN}cat access.{RESET} do? {BRIGHT_CYAN}(Lệnh cat access. dùng để làm gì?),,
50207d64-9f56-4751-8c30-792f75ee9a3d,Concatenates and displays all files in the current directory. {BRIGHT_CYAN}(Ghép và hiển thị toàn bộ file trong thư mục hiện tại.),What does {BRIGHT_GREEN}cat *{RESET} do? {BRIGHT_CYAN}(Lệnh cat * dùng để làm gì?),,
f214c6a6-616e-4a95-b610-869c0e2ded2e,Concatenates files matching *access.log*. {BRIGHT_CYAN}(Ghép và in file khớp với *access.log*.),What does {BRIGHT_GREEN}cat access.log{RESET} do? {BRIGHT_CYAN}(Lệnh cat access.log dùng để làm gì?),,
b34955cd-3d73-498b-a72d-28d3bbb6d7df,Concatenates files matching access.l*. {BRIGHT_CYAN}(Ghép và in file khớp với access.l*.),What does {BRIGHT_GREEN}cat access.l*{RESET} do? {BRIGHT_CYAN}(Lệnh cat access.l* dùng để làm gì?),,
6f5b0e8c-f0e1-4f37-9137-8e9ff636175b,"Concatenates files starting with a and ending with g. {BRIGHT_CYAN}(Ghép và in file bắt đầu bằng a, kết thúc bằng g.)",What does {BRIGHT_GREEN}cat ag{RESET} do? {BRIGHT_CYAN}(Lệnh cat ag dùng để làm gì?),,
56cefda1-b7d2-4d3e-ac87-0402b50d9a4d,"Concatenates files starting with a and ending with log. {BRIGHT_CYAN}(Ghép và in file bắt đầu bằng a, kết thúc bằng log.)",What does {BRIGHT_GREEN}cat alog{RESET} do? {BRIGHT_CYAN}(Lệnh cat alog dùng để làm gì?),,
e106a0c5-bd9b-4a1f-b716-bb9d767999d0,Concatenates files starting with ac. {BRIGHT_CYAN}(Ghép và in file bắt đầu bằng ac.),What does {BRIGHT_GREEN}cat ac*{RESET} do? {BRIGHT_CYAN}(Lệnh cat ac* dùng để làm gì?),,
c17dcc53-a934-465a-99f7-eb7533ef5713,Concatenates files starting with acce. {BRIGHT_CYAN}(Ghép và in file bắt đầu bằng acce.),What does {BRIGHT_GREEN}cat acce*{RESET} do? {BRIGHT_CYAN}(Lệnh cat acce* dùng để làm gì?),,
508c9931-385a-4598-b7b5-51779ff37db7,Concatenates files starting with acces. {BRIGHT_CYAN}(Ghép và in file bắt đầu bằng acces.),What does {BRIGHT_GREEN}cat acces*{RESET} do? {BRIGHT_CYAN}(Lệnh cat acces* dùng để làm gì?),,
f56f67a4-9368-439c-91b4-479384888f98,"Displays access.log (quotes have no effect here). {BRIGHT_CYAN}(Hiển thị file access.log, dấu ngoặc kép không ảnh hưởng.)","What does {BRIGHT_GREEN}cat ""access.log""{RESET} do? {BRIGHT_CYAN}(Lệnh cat ""access.log"" dùng để làm gì?)",,
35bbba1e-56c7-4fdf-923e-8c31894c7c30,Displays access.log from the current directory. {BRIGHT_CYAN}(Hiển thị file access.log trong thư mục hiện tại.),What does {BRIGHT_GREEN}cat ./access.log{RESET} do? {BRIGHT_CYAN}(Lệnh cat ./access.log dùng để làm gì?),,
6c482c26-2c78-4cde-b00f-5196ce374d6f,Displays access.log. {BRIGHT_CYAN}(Hiển thị file access.log.),What does {BRIGHT_GREEN}cat 'access.log'{RESET} do? {BRIGHT_CYAN}(Lệnh cat 'access.log' dùng để làm gì?),,
48969c7c-ed40-4176-acf2-1ff69fa92bb6,Displays file one screen at a time. {BRIGHT_CYAN}(Hiển thị nội dung file theo từng trang màn hình.),What does {BRIGHT_GREEN}pg access.log{RESET} do? {BRIGHT_CYAN}(Lệnh pg access.log dùng để làm gì?),,
1e196b3b-fd2b-4b4a-9907-477f1a76ce82,"Displays file, semicolon has no effect. {BRIGHT_CYAN}(Hiển thị file, dấu ; không ảnh hưởng.)",What does {BRIGHT_GREEN}cat access.log;{RESET} do? {BRIGHT_CYAN}(Lệnh cat access.log; dùng để làm gì?),,
c29719f8-d4fa-436d-9207-b420a50c67eb,"Displays file, shows non-printable chars. {BRIGHT_CYAN}(Hiển thị file, hiện ký tự không in được.)",What does {BRIGHT_GREEN}cat -v access.log{RESET} do? {BRIGHT_CYAN}(Lệnh cat -v access.log dùng để làm gì?),,
3112f2b7-8d5b-4a3b-94e9-113f39ef9dcd,"Displays file, shows tabs as ^I. {BRIGHT_CYAN}(Hiển thị file, tab hiện thành ^I.)","What does {BRIGHT_GREEN}cat -t ""access.log""{RESET} do? {BRIGHT_CYAN}(Lệnh cat -t ""access.log"" dùng để làm gì?)",,
7d022fcd-3bfc-4dcb-9508-62726defe999,"Displays file, shows tabs as ^I. {BRIGHT_CYAN}(Hiển thị file, tab hiện thành ^I.)",What does {BRIGHT_GREEN}cat -t access.log{RESET} do? {BRIGHT_CYAN}(Lệnh cat -t access.log dùng để làm gì?),,
b873080f-249c-416b-b24d-a7ff47b1ca8f,Displays that file’s contents. {BRIGHT_CYAN}(Hiển thị nội dung file ở đường dẫn trên.),What does {BRIGHT_GREEN}cat /var/challenges/print_file_contents/access.log{RESET} do? {BRIGHT_CYAN}(Lệnh cat /var/challenges/print_file_contents/access.log dùng để làm gì?),,
d82df4ac-dc97-4259-a487-ad6bcc63ea50,Displays the contents of access.log. {BRIGHT_CYAN}(Hiển thị nội dung file access.log.),What does {BRIGHT_GREEN}cat access.log{RESET} do? {BRIGHT_CYAN}(Lệnh cat access.log dùng để làm gì?),,
bac6fbb7-a4da-4b37-a442-21fb4422390a,Matches and prints all lines. {BRIGHT_CYAN}(Khớp và in mọi dòng trong file.),What does {BRIGHT_GREEN}grep '.' access.log{RESET} do? {BRIGHT_CYAN}(Lệnh grep '.' access.log dùng để làm gì?),,
a9d50fa6-50ae-44a7-962c-eb813efe3808,Matches lines with at least one underscore. {BRIGHT_CYAN}(In ra các dòng có ít nhất một dấu gạch dưới _.),What does {BRIGHT_GREEN}grep '*' access.log{RESET} do? {BRIGHT_CYAN}(Lệnh grep '*' access.log dùng để làm gì?),,
b0610e4c-3d7a-4a15-904a-81f5c2051c3f,Prints all non-empty lines. {BRIGHT_CYAN}(In tất cả dòng không rỗng trong file.),What does {BRIGHT_GREEN}grep . access.log{RESET} do? {BRIGHT_CYAN}(Lệnh grep . access.log dùng để làm gì?),,
ff73281b-64ac-4d78-b645-312fd8abf819,"Prints every line (empty regex matches all). {BRIGHT_CYAN}(In toàn bộ dòng, vì regex rỗng khớp với tất cả.)","What does {BRIGHT_GREEN}grep """" access.log{RESET} do? {BRIGHT_CYAN}(Lệnh grep """" access.log dùng để làm gì?)",,
c98d4af1-b8ea-4858-9748-ccaf45fffe1d,Prints every line of access.log. {BRIGHT_CYAN}(In toàn bộ nội dung file access.log.),What does {BRIGHT_GREEN}awk '{print $0}' access.log{RESET} do? {BRIGHT_CYAN}(Lệnh awk '{print $0}' access.log dùng để làm gì?),,
c60cca75-6a4b-4a5e-973c-b10b0b85ab7a,"Prints file contents (extra space ignored). {BRIGHT_CYAN}(In nội dung file, khoảng trắng không ảnh hưởng.)","What does {BRIGHT_GREEN}echo ""$(<access.log )""{RESET} do? {BRIGHT_CYAN}(Lệnh echo ""$(<access.log )"" dùng để làm gì?)",,
07f5b015-5f46-48a7-b089-32da83ff7672,"Prints file contents (space ignored). {BRIGHT_CYAN}(In nội dung file, khoảng trắng không ảnh hưởng.)","What does {BRIGHT_GREEN}echo ""$(< access.log)""{RESET} do? {BRIGHT_CYAN}(Lệnh echo ""$(< access.log)"" dùng để làm gì?)",,
221c0518-e2a5-49c5-b055-3e53d0b7d215,"Quotes do nothing, runs cat. {BRIGHT_CYAN}(Dấu nháy không ảnh hưởng, vẫn chạy cat.)",What does {BRIGHT_GREEN}'cat' access.log{RESET} do? {BRIGHT_CYAN}(Lệnh 'cat' access.log dùng để làm gì?),,
155dae62-d260-4916-9ed1-ce00bfb058f2,Reads file line by line and echoes each. {BRIGHT_CYAN}(Đọc file từng dòng rồi in ra từng dòng.),What does {BRIGHT_GREEN}while read line; do echo $line; done < access.log{RESET} do? {BRIGHT_CYAN}(Lệnh while read line; do echo $line; done < access.log dùng để làm gì?),,
252167bb-413b-453f-8cc5-ec2a2b1c347e,"Redirects file into cat, prints it. {BRIGHT_CYAN}(Chuyển hướng file vào cat để in ra.)",What does {BRIGHT_GREEN}cat <access.log{RESET} do? {BRIGHT_CYAN}(Lệnh cat <access.log dùng để làm gì?),,
3756a056-ecf4-4837-ada5-e2dc437aeaf0,"Redirects file into cat, prints it. {BRIGHT_CYAN}(Chuyển hướng nội dung file vào cat và in ra.)",What does {BRIGHT_GREEN}cat < access.log{RESET} do? {BRIGHT_CYAN}(Lệnh cat < access.log dùng để làm gì?),,
288ef4ac-5e0e-4171-8800-7a71d6a3a2d2,Shows last 10 lines of access.log. {BRIGHT_CYAN}(Hiển thị 10 dòng cuối của file access.log.),What does {BRIGHT_GREEN}cat access.log | tail{RESET} do? {BRIGHT_CYAN}(Lệnh cat access.log | tail dùng để làm gì?),,
ad82aefa-ec3c-4d6d-9b3d-959a8f9e915f,Shows last 10 lines of file in current dir. {BRIGHT_CYAN}(Hiển thị 10 dòng cuối của file trong thư mục hiện tại.),What does {BRIGHT_GREEN}tail ./access.log{RESET} do? {BRIGHT_CYAN}(Lệnh tail ./access.log dùng để làm gì?),,
3753f44e-5fd1-4efb-9db1-8ce9442f077e,"Shows last 10 lines, extra space ignored. {BRIGHT_CYAN}(Hiển thị 10 dòng cuối, khoảng trắng dư không ảnh hưởng.)",What does {BRIGHT_GREEN}tail access.log{RESET} do? {BRIGHT_CYAN}(Lệnh tail access.log dùng để làm gì?),,
fd830c97-10a1-4952-8789-640428e6a718,Shows the first 10 lines of access.log. {BRIGHT_CYAN}(Hiển thị 10 dòng đầu của file access.log.),What does {BRIGHT_GREEN}head access.log{RESET} do? {BRIGHT_CYAN}(Lệnh head access.log dùng để làm gì?),,
7f1df7e9-cf6f-4b4a-bbfb-642571e48b2d,Shows the last 10 lines of access.log. {BRIGHT_CYAN}(Hiển thị 10 dòng cuối của file access.log.),What does {BRIGHT_GREEN}tail access.log{RESET} do? {BRIGHT_CYAN}(Lệnh tail access.log dùng để làm gì?),,
c967207f-628a-49dd-8c0f-6343e5d54d76,"Subshell substitution, prints content of access.log. {BRIGHT_CYAN}(Dùng lệnh lồng, in nội dung file access.log.)","What does {BRIGHT_GREEN}echo ""<access.log""{RESET} do? {BRIGHT_CYAN}(Lệnh echo ""<access.log"" dùng để làm gì?)",,
384876b9-2fd6-4add-b2ea-fb9a4b6ef543,Uses absolute path to display file. {BRIGHT_CYAN}(Dùng đường dẫn tuyệt đối để in nội dung file.),What does {BRIGHT_GREEN}cat $(pwd)/access.log{RESET} do? {BRIGHT_CYAN}(Lệnh cat $(pwd)/access.log dùng để làm gì?),,
