id,answer,question,desc,ref
e5ea1f76-8e76-4801-87e3-62ff8c931da0,"Bảo vệ dữ liệu khỏi truy cập, lạm dụng, tiết lộ, phá hủy hoặc gián đoạn trái phép.",Mục tiêu chung của các quy trình InfoSec là gì?,- Các quy trình này đảm bảo nguyên tắc CIA (Confidentiality – Integrity – Availability).,
c21e5727-64cc-455c-adba-5a5339db73d0,"Bảo vệ dữ liệu nhạy cảm, duy trì hoạt động, tuân thủ quy định và bảo vệ danh tiếng tổ chức.",Mục đích chính của InfoSec là gì?,Là nền tảng để tổ chức phát triển bền vững trong môi trường số.,
0333d2c2-432f-43f9-bb6f-5b30ebf7565c,Bảo vệ tính bảo mật và toàn vẹn của dữ liệu bằng cách mã hóa.,Encryption Tools được sử dụng để làm gì?,"- Ví dụ: GPG, VeraCrypt.",
9a7d5181-6595-4fb8-be7a-e9d57186d0ad,Cho phép áp dụng công nghệ mới một cách an toàn và có kiểm soát.,InfoSec giúp hỗ trợ Digital Transformation như thế nào?,Cân bằng giữa đổi mới và quản lý rủi ro bảo mật.,
e4c56bd8-4af9-4698-a6f0-12549d63fed6,"Cung cấp khung quản lý và bảo vệ hiệu quả thông tin nhạy cảm, hướng dẫn xây dựng chính sách và kiểm soát bảo mật.",Nguyên tắc nền tảng của InfoSec nhằm mục đích gì?,"- Là “kim chỉ nam” giúp tổ chức thiết kế, vận hành và đánh giá các biện pháp an ninh.",
7857492f-ec29-48bc-86c3-922bd0b021c6,Công cụ phát hiện điểm yếu trong hệ thống và ứng dụng.,Vulnerability Scanners là gì?,- Giúp đánh giá rủi ro trước khi kẻ tấn công khai thác.,
128e1e23-828a-4d80-b41b-ab4f296f9a4c,Duy trì khả năng truy cập hệ thống và dữ liệu trong sự cố hoặc thảm họa.,InfoSec giúp đảm bảo Business Continuity bằng cách nào?,Đảm bảo doanh nghiệp không bị gián đoạn hoạt động.,
13200de6-3442-49f0-9f37-5c567017c5dd,Giáo dục người dùng về thực hành bảo mật tốt.,Security Awareness Training Platforms có mục tiêu gì?,- Con người là “mắt xích yếu” – đào tạo giúp giảm rủi ro.,
b7a307e3-c337-4934-add2-155faeb28514,"Giúp ngăn sự cố rò rỉ dữ liệu, thể hiện cam kết bảo vệ khách hàng.",Làm sao InfoSec góp phần bảo vệ danh tiếng thương hiệu?,- Uy tín là yếu tố sống còn trong môi trường cạnh tranh số.,
d2e6a240-e566-43f5-9e79-958d263a5620,"Giúp tổ chức tuân thủ luật và tiêu chuẩn bảo mật, tránh phạt và mất uy tín.",Tại sao Regulatory Compliance quan trọng trong InfoSec?,"- Ví dụ như GDPR, ISO 27001, PCI-DSS.",
d143f382-4ae1-4182-a126-e9ab37cf5be8,Intrusion Detection/Prevention Systems – giám sát và ngăn chặn hoạt động đáng ngờ.,IDS/IPS là gì?,"- IDS phát hiện, IPS chủ động chặn tấn công.",
30d853e2-b281-471a-a523-8bd726d6573c,"Kiểm soát lưu lượng mạng vào và ra, ngăn truy cập trái phép.",Firewalls có chức năng gì?,Là lớp bảo vệ đầu tiên giữa mạng nội bộ và Internet.,
47854a44-5bf6-4fe5-b4a4-20ce5572b616,"Mô phỏng tấn công để tìm lỗ hổng bảo mật (ví dụ: Metasploit, Burp Suite).",Penetration Testing Tools có vai trò gì?,- Dùng trong kiểm thử xâm nhập hợp pháp.,
4876d0a2-059d-47c9-a39e-7334447c65dc,"Ngăn đánh cắp hoặc sử dụng trái phép ý tưởng, sáng chế, hay dữ liệu độc quyền.",Bảo vệ tài sản trí tuệ trong InfoSec nghĩa là gì?,- Giúp doanh nghiệp duy trì lợi thế cạnh tranh.,
01993393-08ef-4a49-8e8e-b57318af7062,"Nmap, Wireshark, Metasploit, Burp Suite, John the Ripper.",Một số công cụ phổ biến cho Penetration Testers là gì?,"- Các công cụ chủ lực để quét, phân tích và khai thác lỗ hổng.",
d53e32e1-f9e4-4501-ae90-b762a8f2479c,"Quy trình phản ứng với sự cố bảo mật nhằm kiểm soát, giảm thiểu và khắc phục hậu quả.",Incident Response là gì?,"- Gồm các bước cô lập, loại bỏ, phục hồi và học hỏi sau sự cố.",
3e3a9e93-7082-48b0-9cfe-15f64b811da0,Quá trình khôi phục hệ thống và dữ liệu sau sự cố lớn.,Disaster Recovery là gì?,- Nhằm giảm thiểu thời gian ngừng hoạt động và mất mát dữ liệu.,
a440659b-2fe8-4f8d-a572-cb4ddbf44d7e,"Quá trình xác định, đánh giá mối đe dọa và lỗ hổng để xác định mức độ rủi ro.",Risk Assessment là gì?,- Giúp ưu tiên nỗ lực bảo mật và phân bổ tài nguyên hợp lý.,
a0c9ac58-6c69-4946-8bd9-6bbbc2f265f7,Quản lý quyền truy cập và xác thực người dùng.,Access Control Systems làm gì?,- Đảm bảo chỉ người có thẩm quyền mới vào được tài nguyên.,
ac1ec625-af53-4ac5-a3f9-fcfc10aa7947,"Quản lý và bảo vệ thông tin cá nhân nhạy cảm, tuân thủ quy định bảo vệ dữ liệu.",Privacy (Quyền riêng tư) trong InfoSec tập trung vào điều gì?,- Thực thi qua tối thiểu hóa dữ liệu và quản lý sự đồng ý của người dùng.,
013c45c4-a2f3-44b3-9aed-ac7e8197a8d9,Theo dõi liên tục và phát hiện các sự kiện hoặc bất thường bảo mật.,Monitoring and Detection trong InfoSec có mục đích gì?,"- Dựa vào công cụ như SIEM, IDS, IPS để phát hiện sớm sự cố.",
14c4bfe6-8a78-4e44-a87e-42f7577afe4f,Thu thập và phân tích dữ liệu sự kiện bảo mật để phát hiện mối đe dọa.,SIEM Systems dùng để làm gì?,- Trung tâm phân tích bảo mật hợp nhất của tổ chức.,
968e04fc-ddf4-468a-bbf3-d4cd65be9ffb,"Triển khai kế hoạch bảo mật, thực thi các giải pháp kỹ thuật và chính sách.",Implementation of Security Controls là gì?,- Bao gồm kiểm soát phòng ngừa và phát hiện.,
764ad009-079d-4a77-9f4b-65c2fab8ef9b,Vì việc sử dụng sai mục đích hoặc không được phép là phạm pháp,Vì sao cần hiểu rõ khía cạnh pháp lý trong việc dùng công cụ kiểm thử bảo mật?,- Chỉ kiểm thử khi có ủy quyền hợp pháp.,
9cc3759f-9c28-4621-9658-5d837694c593,"Xác minh danh tính của người dùng, thiết bị hoặc tiến trình.",Authentication (Xác thực) là gì?,"- Thường dùng mật khẩu, sinh trắc học, hoặc xác thực đa yếu tố (MFA).",
ff383b69-02f2-4693-9953-1449a59bd36d,"Xây dựng chiến lược, chính sách, và quy trình để giải quyết rủi ro đã xác định.",Security Planning là gì?,- Là giai đoạn định hướng trong quản lý bảo mật.,
dda483b2-1dd8-4e89-988e-689d9c8d6865,"Đánh giá, rút kinh nghiệm và cập nhật biện pháp bảo mật theo mối đe dọa mới.",Continuous Improvement trong InfoSec có nghĩa là gì?,"- Gồm đánh giá định kỳ, kiểm toán và cập nhật quy trình.",
03d30550-0407-43fb-9817-ec7f976143c3,"Đảm bảo dữ liệu chính xác và đầy đủ trong suốt vòng đời của nó, ngăn thay đổi trái phép.",Integrity (Tính toàn vẹn) là gì?,- Thực thi qua hashing và chữ ký số.,
ce2f8c18-802a-4d8c-aebd-3e2fd7d3fa64,Đảm bảo một bên không thể phủ nhận việc đã ký tài liệu hay gửi thông điệp.,Non-repudiation (Chống chối bỏ) là gì?,"- Rất quan trọng trong thương mại điện tử, dùng chữ ký số và log kiểm toán.",
2cd374ab-14c8-4de6-81a6-8109ed164679,Đảm bảo người dùng hợp pháp có thể truy cập thông tin khi cần.,Availability (Tính sẵn sàng) là gì?,- Duy trì qua cơ chế dự phòng và kế hoạch phục hồi thảm họa.,
79987ddc-4636-414e-8f4d-af5681c98e5b,"Đảm bảo thông tin chỉ có thể truy cập bởi người được phép, ngăn tiết lộ trái phép.",Confidentiality (Tính bảo mật) là gì?,- Thường được thực thi qua mã hóa và kiểm soát truy cập.,
b9d4b197-5e9e-4900-be6d-6c05f6ab8ced,"Để tránh truy cập trái phép, rò rỉ thông tin, thiệt hại tài chính và uy tín.",Tại sao cần bảo vệ dữ liệu nhạy cảm?,Dữ liệu là tài sản quý giá nhất trong kỷ nguyên kỹ thuật số.,
