id,answer,question,desc,ref
8179846b-69b7-4b0e-836b-9d2d4c2323e4,Weaponization,Bạn là một chuyên gia kiểm thử xâm nhập được giao nhiệm vụ kiểm tra nhận thức của nhân viên công ty XYZ. Bạn đã thu thập được hai địa chỉ email của nhân viên từ các nguồn công khai và đang tạo ra một backdoor phía máy khách để gửi qua email cho các nhân viên đó. Bạn đang ở giai đoạn nào của Chuỗi tiêu diệt mạng (Cyber Kill Chain)?,"* Chuỗi tiêu diệt mạng (Cyber Kill Chain) của Lockheed Martin mô tả bảy giai đoạn của một cuộc tấn công mạng, từ trinh sát đến mục tiêu cuối cùng. Giai đoạn Vũ khí hóa (Weaponization) là giai đoạn tạo ra công cụ tấn công. Hành động của Tony: \n\t- Thu thập email từ các nguồn công khai - Đây là giai đoạn đầu tiên, thu thập thông tin về mục tiêu (như địa chỉ email, tên miền). (Reconnaissance (Trinh sát) \n\t- Tạo ra một backdoor phía máy khách để gửi qua email - Đây là hành động kết hợp một mã khai thác (exploit) với một cổng sau (backdoor) hoặc tải trọng (payload) thành một ""vũ khí"" có thể truyền tải được (ví dụ: tệp đính kèm độc hại, liên kết độc hại). Weaponization (Vũ khí hóa) \n\n* Trong kịch bản này, việc tạo ra tệp backdoor để gửi qua email là hành động chế tạo công cụ tấn công, khớp hoàn toàn với định nghĩa của giai đoạn Weaponization.",
2b0ae7cd-5645-4d12-a587-d3a178b9f794,Web-Stat,"Taylor, một chuyên gia bảo mật, sử dụng một công cụ để giám sát trang web của công ty, phân tích lưu lượng truy cập trang web và theo dõi vị trí địa lý của người dùng truy cập trang web của công ty. Công cụ nào sau đây đã được Taylor sử dụng trong kịch bản trên?","* Web-Stat là một dịch vụ và công cụ phân tích lưu lượng truy cập web (Web Traffic Analytics) thời gian thực chuyên dụng. \n\t- Chức năng cốt lõi: Web-Stat được thiết kế để cung cấp cho quản trị viên trang web dữ liệu chi tiết về hoạt động của khách truy cập. \n\t- Đặc điểm khớp với kịch bản: \n\t\t+ Monitor her company's website & analyze the website’s traffic: Đây là chức năng cơ bản của công cụ phân tích web, bao gồm số lượng khách truy cập, các trang được xem, thời gian ở lại trang, v.v. \n\t\t+ Track the geographical location of the users: Web-Stat nổi tiếng với khả năng cung cấp dữ liệu địa lý chính xác (thành phố, quốc gia) của khách truy cập, một tính năng quan trọng để phân tích nguồn gốc lưu lượng truy cập và đánh giá rủi ro an ninh theo khu vực. \n\n* Trong bối cảnh câu hỏi tập trung vào phân tích lưu lượng truy cập và theo dõi vị trí địa lý, Web-Stat là công cụ phù hợp nhất.",
f177e41c-1ed9-4bf7-850d-0b170295d6cd,Website mirroring,"Jane, một hacker mũ trắng, đang kiểm tra máy chủ web và trang web của một tổ chức mục tiêu để xác định các lỗ hổng bảo mật. Trong quá trình này, cô ấy đã sao chép toàn bộ trang web và nội dung của nó vào một ổ đĩa cục bộ để xem toàn bộ cấu trúc thư mục, cấu trúc tệp, liên kết ngoài, hình ảnh, các trang web, v.v. của trang web. Thông tin này giúp Jane lập bản đồ các thư mục của trang web và thu thập thông tin có giá trị. Kỹ thuật tấn công nào đã được Jane sử dụng trong kịch bản trên?","* Website Mirroring là kỹ thuật mà kẻ tấn công (hoặc chuyên gia kiểm thử) sử dụng các công cụ tự động (như HTTrack, Wget) để tải xuống và sao chép toàn bộ cấu trúc và nội dung của một trang web từ máy chủ web mục tiêu về máy cục bộ. \n\t- Đặc điểm khớp với kịch bản: \n\t\t+ Hành động của Jane: ""copied the entire website and its content on a local drive"" (sao chép toàn bộ trang web và nội dung vào ổ đĩa cục bộ). \n\t\t+ Mục đích: Để ""view the complete profile of the site’s directory structure, file structure, external links, images, web pages, and so on"" (xem toàn bộ cấu trúc thư mục, tệp, v.v.). \n\t- Mục đích trong tấn công: Kỹ thuật này thuộc giai đoạn Footprinting (thu thập thông tin) và rất quan trọng vì nó cho phép Jane: \n\t\t+ Phân tích cấu trúc thư mục mà không cần gửi nhiều yêu cầu đến máy chủ (giảm thiểu khả năng bị phát hiện). \n\t\t+ Tìm kiếm các tệp cấu hình ẩn, tệp tin dự phòng (.bak, .old), hoặc các bình luận HTML tiết lộ thông tin nhạy cảm. \n\t\t+ Lập bản đồ trang web (sitemap/directory mapping) chi tiết.",
b31532f7-101f-47bb-83a5-c7661a9a981c,Whitelist validation,"CyberTech Inc. gần đây đã phải hứng chịu các cuộc tấn công SQL injection trên trang web chính thức của họ. Công ty bổ nhiệm Bob, một chuyên gia bảo mật, để xây dựng và đưa vào các chiến lược phòng thủ chống lại các cuộc tấn công đó. Bob đã áp dụng một phương pháp trong đó chỉ một danh sách các thực thể như kiểu dữ liệu, phạm vi, kích thước và giá trị, đã được chấp thuận cho truy cập an toàn, mới được chấp nhận. Kỹ thuật phòng thủ nào đã được Bob sử dụng trong kịch bản trên?","* Xác thực danh sách trắng (Whitelist Validation) là một kỹ thuật bảo mật cốt lõi, đặc biệt hiệu quả trong việc ngăn chặn các cuộc tấn công chèn mã như SQL Injection. \n\t- Nguyên tắc hoạt động: Kỹ thuật này yêu cầu định nghĩa một danh sách các đầu vào an toàn (whitelist) đã được biết và chấp thuận. Chỉ những đầu vào khớp chính xác với các tiêu chí trong danh sách này (như kiểu dữ liệu, kích thước, phạm vi giá trị hợp lệ) mới được chấp nhận để xử lý. \n\t- Khớp với kịch bản: Bob áp dụng phương pháp ""chỉ một danh sách các thực thể... đã được chấp thuận cho truy cập an toàn, mới được chấp nhận."" \n\t\t+ Việc kiểm tra nghiêm ngặt kiểu dữ liệu, phạm vi, kích thước và giá trị là các tiêu chí điển hình của xác thực danh sách trắng. \n\t\t+ Bằng cách loại bỏ bất kỳ đầu vào nào không nằm trong danh sách an toàn, Bob ngăn chặn các ký tự hoặc lệnh SQL độc hại xâm nhập vào truy vấn cơ sở dữ liệu.",
50e44a81-7940-4541-833d-f01b7b638ea0,WPA3-Enterprise,"Giao thức bảo mật không dây này cho phép sử dụng các giao thức bảo mật với độ mạnh tối thiểu 192-bit và các công cụ mật mã để bảo vệ dữ liệu nhạy cảm, chẳng hạn như GCMP-256, HMAC-SHA384, và ECDSA sử dụng đường cong elliptic 384-bit. Đây là giao thức nào trong bảo mật không dây?","* Các đặc điểm kỹ thuật được mô tả trong câu hỏi chính là các yêu cầu của Chế độ Bảo mật 192-bit (192-bit Security Mode), một tính năng bắt buộc trong giao thức WPA3-Enterprise: \n\t- Độ mạnh bảo mật tối thiểu 192-bit (192-bit Minimum Strength): WPA3-Enterprise bao gồm một chế độ hoạt động đặc biệt được thiết kế cho các môi trường yêu cầu bảo mật cao nhất (chính phủ, tài chính). Chế độ này yêu cầu tất cả các khóa và thuật toán phải có độ mạnh mật mã tối thiểu 192-bit để chống lại các cuộc tấn công Brute-force. \n\t- Bộ công cụ mật mã (Cryptographic Tools): \n\t\t+ GCMP-256 (Galois Counter Mode Protocol với khóa 256 bit): Được sử dụng để bảo mật dữ liệu. Đây là nâng cấp từ GCMP-128 được sử dụng trong WPA3 tiêu chuẩn. \n\t\t+ HMAC-SHA384: Hàm băm mật mã được sử dụng để xác thực thông điệp (HMAC) với độ dài băm 384 bit. \n\t\t+ ECDSA (Elliptic Curve Digital Signature Algorithm) 384-bit: Được sử dụng để tạo và xác minh chữ ký số, cung cấp độ bảo mật cao hơn so với các thuật toán dựa trên RSA truyền thống. \n\n* Các thuật toán và kích thước khóa này (384-bit, 256-bit) đều được đồng bộ hóa để cung cấp sức mạnh bảo mật hiệu quả là 192-bit (theo yêu cầu của Cơ quan An ninh Quốc gia Hoa Kỳ - NSA, trong bộ thuật toán Suite B).",
